,id,favorite_count,retweet_count,retweeted,full_text,source,created_at
1133,726935089318363137,7272,2647,False,This is Sprout. He's just precious af. 12/10 I'd do anything for Sprout https://t.co/DxlX1yTVYY,"<a href=""http://twitter.com/download/iphone"" rel=""nofollow"">Twitter for iPhone</a>",2016-05-02 00:43:25
1134,726887082820554753,4048,1624,False,This is Blitz. He's a new dad struggling to cope mentally with the pressures of being a father. Sick shades 10/10 https://t.co/2AVcJ2BZsy,"<a href=""http://twitter.com/download/iphone"" rel=""nofollow"">Twitter for iPhone</a>",2016-05-01 21:32:40
1135,726828223124897792,3749,1087,False,This is Bloop. He's a Phoenician Winnebago. Tongue is just wow. That box is all he has (tragic). 12/10 would caress https://t.co/DWNrPPXgHA,"<a href=""http://twitter.com/download/iphone"" rel=""nofollow"">Twitter for iPhone</a>",2016-05-01 17:38:46
1136,726224900189511680,4660,1247,False,I'm getting super heckin frustrated with you all sending in non canines like this ostrich. We only rate dogs... 9/10 https://t.co/Rgbni2Ns8z,"<a href=""http://twitter.com/download/iphone"" rel=""nofollow"">Twitter for iPhone</a>",2016-04-30 01:41:23
1137,725842289046749185,7439,2854,False,This is Colby. He's currently regretting all those times he shook your hand for an extra treat. 12/10 https://t.co/vtVHtKFtBH,"<a href=""http://twitter.com/download/iphone"" rel=""nofollow"">Twitter for iPhone</a>",2016-04-29 00:21:01
1138,725786712245440512,4399,1462,False,Say hello to Lillie. She's a Rutabagan Floofem. Poor pupper ate and then passed out. 11/10 relatable af https://t.co/uIdGqug9rw,"<a href=""http://twitter.com/download/iphone"" rel=""nofollow"">Twitter for iPhone</a>",2016-04-28 20:40:11
1139,725729321944506368,5483,1924,False,This is Lola. She's a Butternut Splishnsplash. They are known to be ferocious af. 12/10 would absolutely still pet https://t.co/adQt5a6TZU,"<a href=""http://twitter.com/download/iphone"" rel=""nofollow"">Twitter for iPhone</a>",2016-04-28 16:52:08
1140,725458796924002305,1488,670,False,"Pup had to be removed cuz it wouldn't have been fair to the opposing team. 13/10 absolute legend âš½ï¸
https://t.co/BHICimO58W","<a href=""http://twitter.com/download/iphone"" rel=""nofollow"">Twitter for iPhone</a>",2016-04-27 22:57:10
1141,724983749226668032,3906,1406,False,This is Fred-Rick. He dabbles in parkour. The elevation gives him power. 12/10 hopefully visiting a mailbox near you https://t.co/qFqLtudIiD,"<a href=""http://twitter.com/download/iphone"" rel=""nofollow"">Twitter for iPhone</a>",2016-04-26 15:29:30
1142,724771698126512129,2499,691,False,Nothin better than a doggo and a sunset. 11/10 https://t.co/JlFqOhrHEs,"<a href=""http://twitter.com/download/iphone"" rel=""nofollow"">Twitter for iPhone</a>",2016-04-26 01:26:53
1143,724405726123311104,5598,1776,False,This is Ashleigh. She's having Coachella withdrawals. Didn't even go tho. 10/10 stay strong pupper https://t.co/nRUaKWnJfH,"<a href=""http://twitter.com/download/iphone"" rel=""nofollow"">Twitter for iPhone</a>",2016-04-25 01:12:38
1144,724049859469295616,4571,1905,False,This is Kreggory. He just took a look at his student debt. 10/10 can't even comprehend it https://t.co/XTsZTgilnT,"<a href=""http://twitter.com/download/iphone"" rel=""nofollow"">Twitter for iPhone</a>",2016-04-24 01:38:33
1145,724046343203856385,2813,598,False,"This is Sarge. Not even he knows what his tongue is doing, but it's pretty damn spectacular. 10/10 https://t.co/pIQEdbBxdL","<a href=""http://twitter.com/download/iphone"" rel=""nofollow"">Twitter for iPhone</a>",2016-04-24 01:24:35
1146,724004602748780546,4419,1703,False,This is Luther. He saw a ghost. Spooked af. 11/10 hang in there pupper https://t.co/EdKG43VvEl,"<a href=""http://twitter.com/download/iphone"" rel=""nofollow"">Twitter for iPhone</a>",2016-04-23 22:38:43
1147,723912936180330496,4104,1316,False,This is Sugar. She's a Bolivian Superfloof. Spherical af. 12/10 would never let go of https://t.co/AhMfUu6Onm,"<a href=""http://twitter.com/download/iphone"" rel=""nofollow"">Twitter for iPhone</a>",2016-04-23 16:34:28
1148,723688335806480385,8134,3212,False,This is Reginald. He starts screaming at random. 12/10 cuddly af https://t.co/YgNuDQbv89,"<a href=""http://twitter.com/download/iphone"" rel=""nofollow"">Twitter for iPhone</a>",2016-04-23 01:41:59
1149,723673163800948736,3196,960,False,This is Ivar. She is a badass Viking warrior. Will sack your village. 10/10 savage af https://t.co/Dz6MiVssVU,"<a href=""http://twitter.com/download/iphone"" rel=""nofollow"">Twitter for iPhone</a>",2016-04-23 00:41:42
1150,723179728551723008,5586,2022,False,This is Jangle. She's addicted to broccoli. It's the only thing she cares about. Tragic af. 8/10 get help pup https://t.co/8dNWp1cSEa,"<a href=""http://twitter.com/download/iphone"" rel=""nofollow"">Twitter for iPhone</a>",2016-04-21 16:00:57
1151,722974582966214656,4344,1697,False,Happy 4/20 from the squad! 13/10 for all https://t.co/eV1diwds8a,"<a href=""http://twitter.com/download/iphone"" rel=""nofollow"">Twitter for iPhone</a>",2016-04-21 02:25:47
1152,722613351520608256,5220,1762,False,Meet Schnitzel. He's a Tropicana Floofboop. Getting too big for his favorite basket. 12/10 just so damn fluffy https://t.co/qjd0UJKYUY,"<a href=""http://twitter.com/download/iphone"" rel=""nofollow"">Twitter for iPhone</a>",2016-04-20 02:30:23
1153,721503162398597120,4919,2018,False,This is Panda. He's happy af. 11/10 https://t.co/IOAk9i4UvE,"<a href=""http://twitter.com/download/iphone"" rel=""nofollow"">Twitter for iPhone</a>",2016-04-17 00:58:53
1154,721001180231503872,2667,661,False,This is Oliver. Bath time is upon him. His fear of the wetness postpones his ultimate pupper destiny. 11/10 https://t.co/AFzzKqR4tT,"<a href=""http://twitter.com/download/iphone"" rel=""nofollow"">Twitter for iPhone</a>",2016-04-15 15:44:11
1155,720785406564900865,3291,840,False,This is Archie. He hears everything you say. Doesn't matter where you are. 12/10 https://t.co/0l4I8famYp,"<a href=""http://twitter.com/download/iphone"" rel=""nofollow"">Twitter for iPhone</a>",2016-04-15 01:26:47
1156,720775346191278080,2620,734,False,This is Berkeley. He's in a predicament. 10/10 someone help him https://t.co/XSEXdQupej,"<a href=""http://twitter.com/download/iphone"" rel=""nofollow"">Twitter for iPhone</a>",2016-04-15 00:46:48
1157,720415127506415616,4350,1608,False,Garden's coming in nice this year. 10/10 https://t.co/5Lra3e4rrw,"<a href=""http://twitter.com/download/iphone"" rel=""nofollow"">Twitter for iPhone</a>",2016-04-14 00:55:25
1158,720389942216527872,6764,2716,False,This is RalphÃ©. He patrols the lake. Looking for babes. 11/10 https://t.co/Pb6iMmo0wk,"<a href=""http://twitter.com/download/iphone"" rel=""nofollow"">Twitter for iPhone</a>",2016-04-13 23:15:21
1159,720340705894408192,3032,1047,False,This is Derek. He just got balled on. Can't even get up. Poor thing. 10/10 hang in there pupper https://t.co/BIRRF3bcWH,"<a href=""http://twitter.com/download/iphone"" rel=""nofollow"">Twitter for iPhone</a>",2016-04-13 19:59:42
1160,720059472081784833,4106,1218,False,This is Charleson. He lost his plunger. Looked everywhere. Can't find it. So sad. 9/10 would comfort https://t.co/pRHX8yn9Yu,"<a href=""http://twitter.com/download/iphone"" rel=""nofollow"">Twitter for iPhone</a>",2016-04-13 01:22:10
1161,720043174954147842,5167,2165,False,This is Neptune. He's a Snowy Swiss Mountain Floofapolis. Cheeky wink. Tongue nifty af. 11/10 would pet so firmly https://t.co/SoZq2Xoopv,"<a href=""http://twitter.com/download/iphone"" rel=""nofollow"">Twitter for iPhone</a>",2016-04-13 00:17:25
1162,719991154352222208,5097,1885,False,This doggo was initially thrilled when she saw the happy cartoon pup but quickly realized she'd been deceived. 10/10 https://t.co/mvnBGaWULV,"<a href=""http://twitter.com/download/iphone"" rel=""nofollow"">Twitter for iPhone</a>",2016-04-12 20:50:42
1163,719704490224398336,4815,1567,False,This is Clyde. He's making sure you're having a good train ride. 12/10 great pupper https://t.co/y206kWHAj0,"<a href=""http://twitter.com/download/iphone"" rel=""nofollow"">Twitter for iPhone</a>",2016-04-12 01:51:36
1164,719551379208073216,5335,2087,False,This is Harnold. He accidentally opened the front facing camera. 10/10 get it together Harnold https://t.co/S6JHaSMtln,"<a href=""http://twitter.com/download/iphone"" rel=""nofollow"">Twitter for iPhone</a>",2016-04-11 15:43:12
1165,719367763014393856,2945,797,False,Meet Sid &amp; Murphy. Murphy floats alongside Sid and whispers motivational quotes in his ear. Magical af. Both 11/10 https://t.co/7mmjyearQW,"<a href=""http://twitter.com/download/iphone"" rel=""nofollow"">Twitter for iPhone</a>",2016-04-11 03:33:34
1166,719339463458033665,4660,1349,False,Say hello to Lucy and Sophie. They think they're the same size. Both 10/10 would snug at same time https://t.co/HW50zkcf2R,"<a href=""http://twitter.com/download/iphone"" rel=""nofollow"">Twitter for iPhone</a>",2016-04-11 01:41:07
1167,719332531645071360,3602,1031,False,This is Pippa. She managed to start the car but is waiting for you to buckle up before driving. Responsible af 11/10 https://t.co/htrlmC7saz,"<a href=""http://twitter.com/download/iphone"" rel=""nofollow"">Twitter for iPhone</a>",2016-04-11 01:13:34
1168,718971898235854848,3682,1183,False,This is Sadie. She is prepared for battle. 10/10 https://t.co/JRckDkZVRT,"<a href=""http://twitter.com/download/iphone"" rel=""nofollow"">Twitter for iPhone</a>",2016-04-10 01:20:33
1169,718939241951195136,5521,1897,False,This is Otis. Everybody look at Otis. 12/10 would probably faint while petting https://t.co/I9qoe1uEih,"<a href=""http://twitter.com/download/iphone"" rel=""nofollow"">Twitter for iPhone</a>",2016-04-09 23:10:47
1170,718631497683582976,19956,8715,False,We normally don't rate marshmallows but this one appears to be flawlessly toasted so I'll make an exception. 10/10 https://t.co/D9jbbmPmos,"<a href=""http://twitter.com/download/iphone"" rel=""nofollow"">Twitter for iPhone</a>",2016-04-09 02:47:55
1171,718613305783398402,2575,519,False,This is Carper. He's a Tortellini Angiosperm. In desperate need of a petting. 11/10 would hug softly https://t.co/lK9YDkRzPj,"<a href=""http://twitter.com/download/iphone"" rel=""nofollow"">Twitter for iPhone</a>",2016-04-09 01:35:37
1172,718540630683709445,2629,1090,False,Get you a pup that can do both. 10/10 https://t.co/zSbyvm62xZ,"<a href=""http://twitter.com/download/iphone"" rel=""nofollow"">Twitter for iPhone</a>",2016-04-08 20:46:50
1173,718460005985447936,2855,573,False,Meet Bowie. He's listening for underground squirrels. Smart af. Left eye is considerably magical. 9/10 would so pet https://t.co/JyNmyjy3fe,"<a href=""http://twitter.com/download/iphone"" rel=""nofollow"">Twitter for iPhone</a>",2016-04-08 15:26:28
1174,718454725339934721,5140,1624,False,"This pic is old but I hadn't seen it until today and had to share. Creative af. 13/10 very good boy, would pet well https://t.co/4kD16wMA1Z","<a href=""http://twitter.com/download/iphone"" rel=""nofollow"">Twitter for iPhone</a>",2016-04-08 15:05:29
1175,718246886998687744,2038,537,False,This is Alexanderson. He's got a weird ass birth mark. Dreadful at fetch. Won't eat kibble. 3/10 wtf @Target https://t.co/FmxOpf2Sgl,"<a href=""http://twitter.com/download/iphone"" rel=""nofollow"">Twitter for iPhone</a>",2016-04-08 01:19:36
1176,718234618122661888,4084,1081,False,This is Suki. She was born with a blurry tail (unfortunate). Next level tongue tho. 11/10 nifty hardwood https://t.co/05S8oYztgb,"<a href=""http://twitter.com/download/iphone"" rel=""nofollow"">Twitter for iPhone</a>",2016-04-08 00:30:51
1177,717841801130979328,2584,642,False,This is Barclay. His father was a banana. 11/10 appeeling af https://t.co/ucOEfr2rjV,"<a href=""http://twitter.com/download/iphone"" rel=""nofollow"">Twitter for iPhone</a>",2016-04-06 22:29:56
1178,717790033953034240,3047,1216,False,"Here's a badass mystery pupper. You weren't aware that you owe him money, but you do. 10/10 shades sick af https://t.co/fv9e9AtzSG","<a href=""http://twitter.com/download/iphone"" rel=""nofollow"">Twitter for iPhone</a>",2016-04-06 19:04:14
1179,717537687239008257,6072,1985,False,People please. This is a Deadly Mediterranean Plop T-Rex. We only rate dogs. Only send in dogs. Thanks you... 11/10 https://t.co/2ATDsgHD4n,"<a href=""http://twitter.com/download/iphone"" rel=""nofollow"">Twitter for iPhone</a>",2016-04-06 02:21:30
1180,717428917016076293,1690,489,False,This is Skittle. He's trying to communicate. 11/10 solid effort https://t.co/6WTfJvtKx6,"<a href=""http://vine.co"" rel=""nofollow"">Vine - Make a Scene</a>",2016-04-05 19:09:17
1181,717421804990701568,3322,909,False,This is Ebby. She's a Zimbabwean Feta. Embarrassed by ridiculously squishy face. 9/10 would squeeze softly https://t.co/LBJqxMGaHi,"<a href=""http://twitter.com/download/iphone"" rel=""nofollow"">Twitter for iPhone</a>",2016-04-05 18:41:02
1182,717047459982213120,6615,2050,False,This is FlÃ¡vio (pronounced Baxter). He's a Benesnoop Cumberdog. Super rare. Symmetrical. 12/10 would pet so well https://t.co/fGgleFiBPq,"<a href=""http://twitter.com/download/iphone"" rel=""nofollow"">Twitter for iPhone</a>",2016-04-04 17:53:31
1183,717009362452090881,3453,1048,False,This is Smokey. He's having some sort of existential crisis. 10/10 hang in there pupper https://t.co/JmgF4dMpw0,"<a href=""http://twitter.com/download/iphone"" rel=""nofollow"">Twitter for iPhone</a>",2016-04-04 15:22:08
1184,716802964044845056,4503,1264,False,This is Link. He struggles with couches. 10/10 would assist https://t.co/SbX4e6Yg3o,"<a href=""http://twitter.com/download/iphone"" rel=""nofollow"">Twitter for iPhone</a>",2016-04-04 01:41:58
1185,716791146589110272,5841,1494,False,Meet Jennifur. She's supposed to be navigating. Not even buckled up. Insubordinate &amp; churlish. 11/10 would still pet https://t.co/h0trcJohYO,"<a href=""http://twitter.com/download/iphone"" rel=""nofollow"">Twitter for iPhone</a>",2016-04-04 00:55:01
1186,716730379797970944,1298,458,False,"There has clearly been a mistake. Pup did nothing wrong. 12/10 would help escape
https://t.co/Juid3nnLbC","<a href=""http://twitter.com/download/iphone"" rel=""nofollow"">Twitter for iPhone</a>",2016-04-03 20:53:33
1187,716447146686459905,13838,6335,False,This is Ozzy. He's acrobatic af. Legendary pupper status achieved. 13/10 https://t.co/gHWsCTu90E,"<a href=""http://vine.co"" rel=""nofollow"">Vine - Make a Scene</a>",2016-04-03 02:08:05
1188,716439118184652801,2495,231,False,This is Bluebert. He just saw that both #FinalFur match ups are split 50/50. Amazed af. 11/10 https://t.co/Kky1DPG4iq,"<a href=""http://twitter.com/download/iphone"" rel=""nofollow"">Twitter for iPhone</a>",2016-04-03 01:36:11
1189,716285507865542656,2932,1168,False,This is Stephanus. She stays woke. 12/10 https://t.co/WIWabMngQZ,"<a href=""http://twitter.com/download/iphone"" rel=""nofollow"">Twitter for iPhone</a>",2016-04-02 15:25:47
1190,716080869887381504,5150,1872,False,Here's a super majestic doggo and a sunset 11/10 https://t.co/UACnoyi8zu,"<a href=""http://twitter.com/download/iphone"" rel=""nofollow"">Twitter for iPhone</a>",2016-04-02 01:52:38
1191,715928423106027520,3365,945,False,This is Bubbles. He's a Yorkshire Piccolope. 11/10 would snug aggressively https://t.co/3BhMojONxq,"<a href=""http://twitter.com/download/iphone"" rel=""nofollow"">Twitter for iPhone</a>",2016-04-01 15:46:52
1192,715758151270801409,3943,1531,False,This is old now but it's absolutely heckin fantastic and I can't not share it with you all. 13/10  https://t.co/wJX74TSgzP,"<a href=""http://vine.co"" rel=""nofollow"">Vine - Make a Scene</a>",2016-04-01 04:30:16
1193,715733265223708672,4929,1828,False,This is a taco. We only rate dogs. Please only send in dogs. Dogs are what we rate. Not tacos. Thank you... 10/10 https://t.co/cxl6xGY8B9,"<a href=""http://twitter.com/download/iphone"" rel=""nofollow"">Twitter for iPhone</a>",2016-04-01 02:51:22
1194,715704790270025728,2955,606,False,This is Bentley. He gives kisses back. 11/10 precious af (vid by @emmaallen25) https://t.co/9PnKkKzoUp,"<a href=""http://vine.co"" rel=""nofollow"">Vine - Make a Scene</a>",2016-04-01 00:58:13
1195,715696743237730304,4119,1388,False,Meet Toby. He's a Lithuanian High-Steppin Stickeroo. One of the more accomplished Stickeroos around. 10/10 so nifty https://t.co/cYPHuJYTjC,"<a href=""http://twitter.com/download/iphone"" rel=""nofollow"">Twitter for iPhone</a>",2016-04-01 00:26:15
1196,715680795826982913,4570,1747,False,This is Zeus. He's downright fabulous. 12/10 https://t.co/sSugyyRuTp,"<a href=""http://twitter.com/download/iphone"" rel=""nofollow"">Twitter for iPhone</a>",2016-03-31 23:22:53
1197,715360349751484417,5773,1694,False,This is Bertson. He just wants to say hi. 11/10 would boop nose https://t.co/hwv7Wq6gDA,"<a href=""http://twitter.com/download/iphone"" rel=""nofollow"">Twitter for iPhone</a>",2016-03-31 02:09:32
1198,715342466308784130,3186,736,False,This is Oscar. He's a world renowned snowball inspector. It's a ruff job but someone has to do it. 10/10 great guy https://t.co/vSufMAKm3C,"<a href=""http://twitter.com/download/iphone"" rel=""nofollow"">Twitter for iPhone</a>",2016-03-31 00:58:29
1199,715220193576927233,2546,706,False,This is Nico. His selfie game is strong af. Excellent use of a sneaky tongue slip. 10/10 star material https://t.co/1OBdJkMOFx,"<a href=""http://twitter.com/download/iphone"" rel=""nofollow"">Twitter for iPhone</a>",2016-03-30 16:52:36
1200,715200624753819648,5410,2031,False,This is Michelangelope. He's half coffee cup. Rare af. 12/10 would hug until someone stopped me https://t.co/tvVDY0G911,"<a href=""http://twitter.com/download/iphone"" rel=""nofollow"">Twitter for iPhone</a>",2016-03-30 15:34:51
1201,715009755312439296,4397,1329,False,This is Siba. She's remarkably mobile. Very sleepy as well. 12/10 would happily transport https://t.co/TjnI33RE1i,"<a href=""http://twitter.com/download/iphone"" rel=""nofollow"">Twitter for iPhone</a>",2016-03-30 02:56:24
1202,714982300363173890,3959,1112,False,This is Calbert. He forgot to clear his Google search history. 9/10 rookie mistake Calbert https://t.co/jRm5J3YCmj,"<a href=""http://twitter.com/download/iphone"" rel=""nofollow"">Twitter for iPhone</a>",2016-03-30 01:07:18
1203,714962719905021952,7769,4608,False,Just in case anyone's having a bad day. 12/10 would bounce with https://t.co/T9sgP9ttnQ,"<a href=""http://vine.co"" rel=""nofollow"">Vine - Make a Scene</a>",2016-03-29 23:49:30
1204,714957620017307648,4364,1530,False,This is Curtis. He's an Albino Haberdasher. Terrified of dandelions. They really spook him up. 10/10 it'll be ok pup https://t.co/s8YcfZrWhK,"<a href=""http://twitter.com/download/iphone"" rel=""nofollow"">Twitter for iPhone</a>",2016-03-29 23:29:14
1205,714631576617938945,3452,1080,False,This is Benedict. He's a feisty pup. Needs a brushing. Portable af. Looks very angry actually. 4/10 might not pet https://t.co/3oeFfHjv0Z,"<a href=""http://twitter.com/download/iphone"" rel=""nofollow"">Twitter for iPhone</a>",2016-03-29 01:53:39
1206,714606013974974464,3821,1005,False,Here are two lil cuddly puppers. Both 12/10 would snug like so much https://t.co/zO4eb7C4tG,"<a href=""http://twitter.com/download/iphone"" rel=""nofollow"">Twitter for iPhone</a>",2016-03-29 00:12:05
1207,714485234495041536,2861,1250,False,This is Blitz. He screams. 10/10 (vid by @yeaahliv) https://t.co/MfW2aym5UF,"<a href=""http://vine.co"" rel=""nofollow"">Vine - Make a Scene</a>",2016-03-28 16:12:09
1208,714258258790387713,3168,773,False,"Meet Travis and Flurp. Travis is pretty chill but Flurp can't lie down properly. 10/10 &amp; 8/10
get it together Flurp https://t.co/Akzl5ynMmE","<a href=""http://twitter.com/download/iphone"" rel=""nofollow"">Twitter for iPhone</a>",2016-03-28 01:10:13
1209,714251586676113411,3449,907,False,This is Thumas. He hates potted plants. 8/10 wtf Thumas https://t.co/rDVueNIcEi,"<a href=""http://twitter.com/download/iphone"" rel=""nofollow"">Twitter for iPhone</a>",2016-03-28 00:43:43
1210,714214115368108032,2394,943,False,Happy Easter from the squad! ðŸ‡ðŸ¶ 13/10 for all https://t.co/YMx4KWJUAB,"<a href=""http://twitter.com/download/iphone"" rel=""nofollow"">Twitter for iPhone</a>",2016-03-27 22:14:49
1211,714141408463036416,4537,1505,False,"I know we only rate dogs, but since it's Easter I guess we could rate a bunny for a change. 10/10 petable as hell https://t.co/O2RlKXigHu","<a href=""http://twitter.com/download/iphone"" rel=""nofollow"">Twitter for iPhone</a>",2016-03-27 17:25:54
1212,713919462244790272,3461,835,False,This is Kanu. He's a Freckled Ticonderoga. Simply flawless. 12/10 would perform an elaborate heist to capture https://t.co/7vyAzIURrE,"<a href=""http://twitter.com/download/iphone"" rel=""nofollow"">Twitter for iPhone</a>",2016-03-27 02:43:58
1213,713909862279876608,2018,590,False,This is Doug. His nose is legendary af. 12/10 (vid by @probably_trey) https://t.co/7IWKfbfihS,"<a href=""http://vine.co"" rel=""nofollow"">Vine - Make a Scene</a>",2016-03-27 02:05:49
1214,713900603437621249,2984,804,False,Happy Saturday here's 9 puppers on a bench. 99/90 good work everybody https://t.co/mpvaVxKmc1,"<a href=""http://twitter.com/download/iphone"" rel=""nofollow"">Twitter for iPhone</a>",2016-03-27 01:29:02
1215,713761197720473600,5157,1485,False,This is Piper. She would really like that tennis ball core. Super sneaky tongue slip. 12/10 precious af https://t.co/QP6GHi5az9,"<a href=""http://twitter.com/download/iphone"" rel=""nofollow"">Twitter for iPhone</a>",2016-03-26 16:15:05
1216,713411074226274305,4657,1393,False,Here we see an extremely rare Bearded Floofmallow. Only a few left in the wild. 11/10 would pet with a purpose https://t.co/jVJJKlPbvq,"<a href=""http://twitter.com/download/iphone"" rel=""nofollow"">Twitter for iPhone</a>",2016-03-25 17:03:49
1217,713177543487135744,7598,3056,False,This is Lance. Lance doesn't give a shit. 10/10 we should all be more like Lance https://t.co/SqnG9Ap28J,"<a href=""http://twitter.com/download/iphone"" rel=""nofollow"">Twitter for iPhone</a>",2016-03-25 01:35:51
1218,713175907180089344,4716,1565,False,Say hello to Opie and Clarkus. Clarkus fell asleep so Opie buried him. Ruthless af 10/10 for both https://t.co/xT7XaY4gnW,"<a href=""http://twitter.com/download/iphone"" rel=""nofollow"">Twitter for iPhone</a>",2016-03-25 01:29:21
1219,712809025985978368,19620,7251,False,This is Stubert. He just arrived. 10/10 https://t.co/HVGs5aAKAn,"<a href=""http://twitter.com/download/iphone"" rel=""nofollow"">Twitter for iPhone</a>",2016-03-24 01:11:29
1220,712717840512598017,13060,5392,False,Please don't send in any more polar bears. We only rate dogs. Thank you... 10/10 https://t.co/83RGhdIQz2,"<a href=""http://twitter.com/download/iphone"" rel=""nofollow"">Twitter for iPhone</a>",2016-03-23 19:09:09
1221,712668654853337088,4393,1311,False,Say hello to Sunny and Roxy. They pull things out of water together. 10/10 for both https://t.co/88aedAmxcl,"<a href=""http://twitter.com/download/iphone"" rel=""nofollow"">Twitter for iPhone</a>",2016-03-23 15:53:42
1222,712438159032893441,5620,1686,False,This is Kane. He's a semi-submerged Haitian Huffleplop. Happy af. Sick waterfall. 11/10 would pat head approvingly https://t.co/7zjEC501Ul,"<a href=""http://twitter.com/download/iphone"" rel=""nofollow"">Twitter for iPhone</a>",2016-03-23 00:37:48
1223,712309440758808576,257,25,False,"Reminder that we made our first set of stickers available! All are 12/10 would stick
Use code ""pupper"" at checkoutðŸ¶

https://t.co/kJIMNyMNKV","<a href=""http://twitter.com/download/iphone"" rel=""nofollow"">Twitter for iPhone</a>",2016-03-22 16:06:19
1224,712097430750289920,4014,1114,False,I can't even comprehend how confused this dog must be right now. 10/10 https://t.co/8AGcQ4hIfK,"<a href=""http://twitter.com/download/iphone"" rel=""nofollow"">Twitter for iPhone</a>",2016-03-22 02:03:52
1225,712092745624633345,3107,970,False,This is Steven. He's inverted af. Also very helpful. Scans anything you want for free. Takes him a while tho. 7/10 https://t.co/tA0ZiQ7JcG,"<a href=""http://twitter.com/download/iphone"" rel=""nofollow"">Twitter for iPhone</a>",2016-03-22 01:45:15
1226,712085617388212225,3423,521,False,"Say hello to Olive and Ruby. They are best buddies. Both 11/10 
1 like = 1 buddy https://t.co/yagmFdKlyL","<a href=""http://twitter.com/download/iphone"" rel=""nofollow"">Twitter for iPhone</a>",2016-03-22 01:16:55
1227,712065007010385924,2397,668,False,This is Chester. He's clearly in charge of the other dogs. Weird ass paws. Not fit for fetch. 6/10 would still pet https://t.co/o2GvskrhHt,"<a href=""http://twitter.com/download/iphone"" rel=""nofollow"">Twitter for iPhone</a>",2016-03-21 23:55:01
1228,711998809858043904,0,135,False,RT @twitter: @dog_rates Awesome Tweet! 12/10. Would Retweet. #LoveTwitter https://t.co/j6FQGhxYuN,"<a href=""http://twitter.com/download/iphone"" rel=""nofollow"">Twitter for iPhone</a>",2016-03-21 19:31:59
1229,711968124745228288,8511,2489,False,Meet Winston. He's trapped in a cup of coffee. Poor pupper. 10/10 someone free him https://t.co/2e6cUtKUuc,"<a href=""http://twitter.com/download/iphone"" rel=""nofollow"">Twitter for iPhone</a>",2016-03-21 17:30:03
1230,711743778164514816,3002,1065,False,Meet Roosevelt. He's calculating the best case scenario if he drops out instead of doing math hw. 11/10 relatable af https://t.co/QcSIRDpfVg,"<a href=""http://twitter.com/download/iphone"" rel=""nofollow"">Twitter for iPhone</a>",2016-03-21 02:38:34
1231,711732680602345472,9394,4445,False,I want to hear the joke this dog was just told. 10/10 https://t.co/1KiuZqqOD4,"<a href=""http://twitter.com/download/iphone"" rel=""nofollow"">Twitter for iPhone</a>",2016-03-21 01:54:29
