,id,favorite_count,retweet_count,retweeted,full_text,source,created_at
550,803276597545603072,10845,2756,False,This is Winston. His selfie game is legendary. Will steal your girl with a single snap. 11/10 handsome as h*ck https://t.co/jxQhxoPsgL,"<a href=""http://twitter.com/download/iphone"" rel=""nofollow"">Twitter for iPhone</a>",2016-11-28 16:37:19
551,802952499103731712,9762,2238,False,This is Marley. She's having a ruff day. Pretty pupset. 12/10 would assist https://t.co/yLm7hQ6UXh,"<a href=""http://twitter.com/download/iphone"" rel=""nofollow"">Twitter for iPhone</a>",2016-11-27 19:09:28
552,802624713319034886,0,3263,False,"RT @dog_rates: ""Yep... just as I suspected. You're not flossing."" 12/10 and 11/10 for the pup not flossing https://t.co/SuXcI9B7pQ","<a href=""http://twitter.com/download/iphone"" rel=""nofollow"">Twitter for iPhone</a>",2016-11-26 21:26:58
553,802600418706604034,7699,1637,False,This is Bailey. She has mastered the head tilt. 11/10 rather h*ckin adorable https://t.co/urhl90ZE1O,"<a href=""http://vine.co"" rel=""nofollow"">Vine - Make a Scene</a>",2016-11-26 19:50:26
554,802572683846291456,9675,2796,False,This is Winnie. She's h*ckin ferocious. Dandelion doesn't even see her coming. 12/10 would pet with caution https://t.co/EFfLCP7oQv,"<a href=""http://twitter.com/download/iphone"" rel=""nofollow"">Twitter for iPhone</a>",2016-11-26 18:00:13
555,802323869084381190,17588,6518,False,This is Severus. He's here to fix your cable. Looks like he succeeded. Even offered to pupgrade your plan. 13/10 h*ckin helpful https://t.co/aX4brLLpWZ,"<a href=""http://twitter.com/download/iphone"" rel=""nofollow"">Twitter for iPhone</a>",2016-11-26 01:31:31
556,802265048156610565,6919,1516,False,"Like doggo, like pupper version 2. Both 11/10 https://t.co/9IxWAXFqze","<a href=""http://twitter.com/download/iphone"" rel=""nofollow"">Twitter for iPhone</a>",2016-11-25 21:37:47
557,802239329049477120,9817,2904,False,This is Loki. He'll do your taxes for you. Can also make room in your budget for all the things you bought today. 12/10 what a puppo https://t.co/5oWrHCWg87,"<a href=""http://twitter.com/download/iphone"" rel=""nofollow"">Twitter for iPhone</a>",2016-11-25 19:55:35
558,802185808107208704,0,297,False,"RT @ChinoChinako: They're good products, Brent

Mug holds drinks; hoodie is comfy af. 13/10 

Puppy Aika h*cking agrees. @dog_rates https:/â€¦","<a href=""http://twitter.com/download/iphone"" rel=""nofollow"">Twitter for iPhone</a>",2016-11-25 16:22:55
559,801958328846974976,8351,1905,False,This is Ronnie. He hopes you're having a great day. Nifty tongue slip. 12/10 would pat head approvingly https://t.co/4fY2bsAm65,"<a href=""http://twitter.com/download/iphone"" rel=""nofollow"">Twitter for iPhone</a>",2016-11-25 01:18:59
560,801854953262350336,1907,261,False,.@NBCSports OMG THE TINY HAT I'M GOING TO HAVE TO SAY 11/10 NBC,"<a href=""http://twitter.com/download/iphone"" rel=""nofollow"">Twitter for iPhone</a>",2016-11-24 18:28:13
561,801538201127157760,8871,2296,False,This is Wallace. He'll be your chau-fur this evening. 12/10 eyes on the road Wallace https://t.co/p1RD39XjUe,"<a href=""http://twitter.com/download/iphone"" rel=""nofollow"">Twitter for iPhone</a>",2016-11-23 21:29:33
562,801285448605831168,6561,926,False,oh h*ck 10/10 https://t.co/bC69RrW559,"<a href=""http://twitter.com/download/iphone"" rel=""nofollow"">Twitter for iPhone</a>",2016-11-23 04:45:12
563,801167903437357056,26545,6646,False,This is Milo. I would do terrible things for Milo. 13/10 https://t.co/R6wJyC2Tey,"<a href=""http://twitter.com/download/iphone"" rel=""nofollow"">Twitter for iPhone</a>",2016-11-22 20:58:07
564,801127390143516673,0,4438,False,RT @dog_rates: This is Anakin. He strives to reach his full doggo potential. Born with blurry tail tho. 11/10 would still pet well https://â€¦,"<a href=""http://twitter.com/download/iphone"" rel=""nofollow"">Twitter for iPhone</a>",2016-11-22 18:17:08
565,801115127852503040,8747,2327,False,This is Bones. He's being haunted by another doggo of roughly the same size. 12/10 deep breaths pupper everything's fine https://t.co/55Dqe0SJNj,"<a href=""http://twitter.com/download/iphone"" rel=""nofollow"">Twitter for iPhone</a>",2016-11-22 17:28:25
566,800859414831898624,747,107,False,@SkyWilliams doggo simply protecting you from evil that which you cannot see. 11/10 would give extra pets,"<a href=""http://twitter.com/download/iphone"" rel=""nofollow"">Twitter for iPhone</a>",2016-11-22 00:32:18
567,800855607700029440,0,1814,False,RT @Lin_Manuel: 11/10 would recommend. https://t.co/pnUF69K4xk,"<a href=""http://twitter.com/download/iphone"" rel=""nofollow"">Twitter for iPhone</a>",2016-11-22 00:17:10
568,800751577355128832,11373,3095,False,Say hello to Mauve and Murphy. They're rather h*ckin filthy. Preferred nap over bath. Both 12/10 https://t.co/4UwCTW3lXG,"<a href=""http://twitter.com/download/iphone"" rel=""nofollow"">Twitter for iPhone</a>",2016-11-21 17:23:47
569,800513324630806528,14222,3354,False,This is Chef. Chef loves everyone and wants everyone to love each other. 11/10 https://t.co/ILHGs0e6Dm,"<a href=""http://twitter.com/download/iphone"" rel=""nofollow"">Twitter for iPhone</a>",2016-11-21 01:37:04
570,800459316964663297,10227,2402,False,Here's a very sleepy pupper. Appears to be portable as h*ck. 12/10 would snug intensely https://t.co/61sX7pW5Ca,"<a href=""http://twitter.com/download/iphone"" rel=""nofollow"">Twitter for iPhone</a>",2016-11-20 22:02:27
571,800443802682937345,0,4815,False,RT @dog_rates: This is Sampson. He's about to get hit with a vicious draw 2. Has no idea. 11/10 poor pupper https://t.co/FYT9QBEnKG,"<a href=""http://twitter.com/download/iphone"" rel=""nofollow"">Twitter for iPhone</a>",2016-11-20 21:00:48
572,800388270626521089,12068,3130,False,This is Doc. He takes time out of every day to worship our plant overlords. 12/10 quite the floofer https://t.co/azMneS6Ly5,"<a href=""http://twitter.com/download/iphone"" rel=""nofollow"">Twitter for iPhone</a>",2016-11-20 17:20:08
573,800188575492947969,0,4397,False,RT @dog_rates: This is Bo. He's a Benedoop Cumbersnatch. Seems frustrated with own feet. Portable as hell. 11/10 very solid pupper https://â€¦,"<a href=""http://twitter.com/download/iphone"" rel=""nofollow"">Twitter for iPhone</a>",2016-11-20 04:06:37
574,800141422401830912,16562,2853,False,This is Peaches. She's the ultimate selfie sidekick. Super sneaky tongue slip appreciated. 13/10 https://t.co/pbKOesr8Tg,"<a href=""http://twitter.com/download/iphone"" rel=""nofollow"">Twitter for iPhone</a>",2016-11-20 00:59:15
575,800018252395122689,30737,14686,False,Here's a doggo doin a struggle. 11/10 much determined https://t.co/gQqRBfkX4I,"<a href=""http://twitter.com/download/iphone"" rel=""nofollow"">Twitter for iPhone</a>",2016-11-19 16:49:49
576,799774291445383169,0,5229,False,RT @dog_rates: This is Tucker. He would like a hug. 13/10 someone hug him https://t.co/wdgY9oHPrT,"<a href=""http://twitter.com/download/iphone"" rel=""nofollow"">Twitter for iPhone</a>",2016-11-19 00:40:24
577,799757965289017345,9096,2411,False,This is Sobe. She's a h*ckin happy doggo. Only one leg tho. Must have good balance. 13/10 would smile back https://t.co/OiH8PaOxB1,"<a href=""http://twitter.com/download/iphone"" rel=""nofollow"">Twitter for iPhone</a>",2016-11-18 23:35:32
578,799422933579902976,8697,2131,False,This is Longfellow (prolly sophisticated). He's a North Appalachian Oatzenjammer. Concerned about wrinkled feets. 12/10 would hug softly https://t.co/bpLuQuxzHZ,"<a href=""http://twitter.com/download/iphone"" rel=""nofollow"">Twitter for iPhone</a>",2016-11-18 01:24:14
579,799308762079035393,0,6181,False,RT @dog_rates: I WAS SENT THE ACTUAL DOG IN THE PROFILE PIC BY HIS OWNER THIS IS SO WILD. 14/10 ULTIMATE LEGEND STATUS https://t.co/7oQ1wpfâ€¦,"<a href=""http://twitter.com/download/iphone"" rel=""nofollow"">Twitter for iPhone</a>",2016-11-17 17:50:33
580,799297110730567681,10746,3088,False,This is Jeffrey. He's quite the jokester. Takes it too far sometimes. Still 11/10 would pet https://t.co/YDtZcAiMAf,"<a href=""http://twitter.com/download/iphone"" rel=""nofollow"">Twitter for iPhone</a>",2016-11-17 17:04:16
581,799063482566066176,8770,2742,False,This is Mister. He only wears the most fashionable af headwear. 11/10 h*ckin stylish https://t.co/BXJFKOVnJm,"<a href=""http://twitter.com/download/iphone"" rel=""nofollow"">Twitter for iPhone</a>",2016-11-17 01:35:54
582,798933969379225600,14267,4997,False,This is Iroh. He's in a predicament. 12/10 someone help him https://t.co/KJAKO2kXsL,"<a href=""http://twitter.com/download/iphone"" rel=""nofollow"">Twitter for iPhone</a>",2016-11-16 17:01:16
583,798925684722855936,8047,1602,False,This is Shadow. He's a firm believer that they're all good dogs. H*ckin passionate about it too. 11/10 I stand with Shadow https://t.co/8yvpacwBcu,"<a href=""http://twitter.com/download/iphone"" rel=""nofollow"">Twitter for iPhone</a>",2016-11-16 16:28:21
584,798705661114773508,0,7381,False,"RT @dog_rates: Meet Baloo. He's expecting a fast ground ball, hence the wide stance. Prepared af. 11/10 nothing runs like a pupper https://â€¦","<a href=""http://twitter.com/download/iphone"" rel=""nofollow"">Twitter for iPhone</a>",2016-11-16 01:54:03
585,798701998996647937,0,8715,False,RT @dog_rates: We normally don't rate marshmallows but this one appears to be flawlessly toasted so I'll make an exception. 10/10 https://tâ€¦,"<a href=""http://twitter.com/download/iphone"" rel=""nofollow"">Twitter for iPhone</a>",2016-11-16 01:39:30
586,798697898615730177,0,7251,False,RT @dog_rates: This is Stubert. He just arrived. 10/10 https://t.co/HVGs5aAKAn,"<a href=""http://twitter.com/download/iphone"" rel=""nofollow"">Twitter for iPhone</a>",2016-11-16 01:23:12
587,798694562394996736,0,5534,False,"RT @dog_rates: I'm not sure what's happening here, but it's pretty spectacular. 12/10 for both https://t.co/JKXh0NbBNL","<a href=""http://twitter.com/download/iphone"" rel=""nofollow"">Twitter for iPhone</a>",2016-11-16 01:09:57
588,798686750113755136,0,2592,False,"RT @dog_rates: Say hello to Jack (pronounced ""Kevin""). He's a Virgo Episcopalian. Can summon rainbows. 11/10 magical as hell https://t.co/Yâ€¦","<a href=""http://twitter.com/download/iphone"" rel=""nofollow"">Twitter for iPhone</a>",2016-11-16 00:38:54
589,798682547630837760,0,5270,False,RT @dog_rates: Here we see a rare pouched pupper. Ample storage space. Looks alert. Jumps at random. Kicked open that door. 8/10 https://t.â€¦,"<a href=""http://twitter.com/download/iphone"" rel=""nofollow"">Twitter for iPhone</a>",2016-11-16 00:22:12
590,798673117451325440,0,6197,False,"RT @dog_rates: I shall call him squishy and he shall be mine, and he shall be my squishy. 13/10 https://t.co/WId5lxNdPH","<a href=""http://twitter.com/download/iphone"" rel=""nofollow"">Twitter for iPhone</a>",2016-11-15 23:44:44
591,798665375516884993,0,4335,False,RT @dog_rates: This is Lola. She fell asleep on a piece of pizza. 10/10 frighteningly relatable https://t.co/eqmkr2gmPH,"<a href=""http://twitter.com/download/iphone"" rel=""nofollow"">Twitter for iPhone</a>",2016-11-15 23:13:58
592,798644042770751489,0,2064,False,RT @dog_rates: This is Paull. He just stubbed his toe. 10/10 deep breaths Paull https://t.co/J5Mqn8VeYq,"<a href=""http://twitter.com/download/iphone"" rel=""nofollow"">Twitter for iPhone</a>",2016-11-15 21:49:12
593,798628517273620480,0,2193,False,RT @dog_rates: This a Norwegian Pewterschmidt named Tickles. Ears for days. 12/10 I care deeply for Tickles https://t.co/0aDF62KVP7,"<a href=""http://twitter.com/download/iphone"" rel=""nofollow"">Twitter for iPhone</a>",2016-11-15 20:47:30
594,798585098161549313,0,6374,False,RT @dog_rates: This is Timison. He just told an awful joke but is still hanging on to the hope that you'll laugh with him. 10/10 https://t.â€¦,"<a href=""http://twitter.com/download/iphone"" rel=""nofollow"">Twitter for iPhone</a>",2016-11-15 17:54:59
595,798576900688019456,0,6547,False,RT @dog_rates: Not familiar with this breed. No tail (weird). Only 2 legs. Doesn't bark. Surprisingly quick. Shits eggs. 1/10 https://t.co/â€¦,"<a href=""http://twitter.com/download/iphone"" rel=""nofollow"">Twitter for iPhone</a>",2016-11-15 17:22:24
596,798340744599797760,0,3750,False,RT @dog_rates: This is Davey. He'll have your daughter home by 8. Just a stand up pup. 11/10 would introduce to mom https://t.co/E6bGWf9EOm,"<a href=""http://twitter.com/download/iphone"" rel=""nofollow"">Twitter for iPhone</a>",2016-11-15 01:44:00
597,798209839306514432,11247,2844,False,This is Cooper. His bow tie was too heavy for the front so he moved it to the side. Balanced af now. 13/10 https://t.co/jG1PAFkB81,"<a href=""http://twitter.com/download/iphone"" rel=""nofollow"">Twitter for iPhone</a>",2016-11-14 17:03:50
598,797971864723324932,12629,3501,False,Here's a helicopter pupper. He takes off at random. H*ckin hard to control. 12/10 rare af https://t.co/GRWPgNKt2z,"<a href=""http://twitter.com/download/iphone"" rel=""nofollow"">Twitter for iPhone</a>",2016-11-14 01:18:12
599,797545162159308800,15713,5419,False,This is Cassie. She steals things. Guilt increases slightly each time. 12/10 would forgive almost immediately https://t.co/Ia19irLwyB,"<a href=""http://twitter.com/download/iphone"" rel=""nofollow"">Twitter for iPhone</a>",2016-11-12 21:02:38
600,797236660651966464,21684,7398,False,This is Pancake. She loves Batman and winks like a h*ckin champ. 12/10 real crowd pleaser https://t.co/6kqsAjJNhi,"<a href=""http://twitter.com/download/iphone"" rel=""nofollow"">Twitter for iPhone</a>",2016-11-12 00:36:46
601,797165961484890113,249,31,False,@JODYHiGHROLLER it may be an 11/10 but what do I know ðŸ˜‰,"<a href=""http://twitter.com/download/iphone"" rel=""nofollow"">Twitter for iPhone</a>",2016-11-11 19:55:50
602,796904159865868288,0,9937,False,RT @dog_rates: This is Tyrone. He's a leaf wizard. Self-motivated. No eyes (tragic). Inspirational af. 11/10 enthusiasm is tangible https:/â€¦,"<a href=""http://twitter.com/download/iphone"" rel=""nofollow"">Twitter for iPhone</a>",2016-11-11 02:35:32
603,796865951799083009,8310,2120,False,This is Tyr. He's just checking on you. Nifty af tongue slip. 12/10 would absolutely pet https://t.co/Jgnuiyvq06,"<a href=""http://twitter.com/download/iphone"" rel=""nofollow"">Twitter for iPhone</a>",2016-11-11 00:03:42
604,796759840936919040,12874,3412,False,Say hello to Romeo. He was just told that it's too cold for the pool. H*ckin nonsense. 11/10 would help fill up https://t.co/6hx7ur6sNI,"<a href=""http://twitter.com/download/iphone"" rel=""nofollow"">Twitter for iPhone</a>",2016-11-10 17:02:03
605,796563435802726400,0,8155,False,RT @dog_rates: I want to finally rate this iconic puppo who thinks the parade is all for him. 13/10 would absolutely attend https://t.co/5dâ€¦,"<a href=""http://twitter.com/download/iphone"" rel=""nofollow"">Twitter for iPhone</a>",2016-11-10 04:01:37
606,796484825502875648,8212,1960,False,Here's a sleepy doggo that requested some assistance. 12/10 would carry everywhere https://t.co/bvkkqOjNDV,"<a href=""http://twitter.com/download/iphone"" rel=""nofollow"">Twitter for iPhone</a>",2016-11-09 22:49:15
607,796387464403357696,11931,4650,False,This is Snicku. He's having trouble reading because he's a dog. Glasses only helped a little. Nap preferred. 12/10 would snug well https://t.co/cVLUasbKA5,"<a href=""http://twitter.com/download/iphone"" rel=""nofollow"">Twitter for iPhone</a>",2016-11-09 16:22:22
608,796177847564038144,0,15961,False,RT @dog_rates: This is Ruby. She just turned on the news. Officially terrified. 11/10 deep breaths Ruby https://t.co/y5KarNXWXt,"<a href=""http://twitter.com/download/iphone"" rel=""nofollow"">Twitter for iPhone</a>",2016-11-09 02:29:25
609,796149749086875649,35060,15961,False,This is Ruby. She just turned on the news. Officially terrified. 11/10 deep breaths Ruby https://t.co/y5KarNXWXt,"<a href=""http://twitter.com/download/iphone"" rel=""nofollow"">Twitter for iPhone</a>",2016-11-09 00:37:46
610,796125600683540480,5349,1987,False,"#ImWithThor 13/10
https://t.co/a18mzkhTf6","<a href=""http://twitter.com/download/iphone"" rel=""nofollow"">Twitter for iPhone</a>",2016-11-08 23:01:49
611,796116448414461957,9846,2701,False,I didn't believe it at first but now I can see that voter fraud is a serious h*ckin issue. 11/10 https://t.co/7i0bDMbrVN,"<a href=""http://twitter.com/download/iphone"" rel=""nofollow"">Twitter for iPhone</a>",2016-11-08 22:25:27
612,796080075804475393,9140,2588,False,This is Yogi. He's 98% floof. Snuggable af. 12/10 https://t.co/opoXKxmfFm,"<a href=""http://twitter.com/download/iphone"" rel=""nofollow"">Twitter for iPhone</a>",2016-11-08 20:00:55
613,796031486298386433,11706,4116,False,This is Daisy. She's here to make your day better. 13/10 mission h*ckin successful https://t.co/PbgvuD0qIL,"<a href=""http://twitter.com/download/iphone"" rel=""nofollow"">Twitter for iPhone</a>",2016-11-08 16:47:50
614,795464331001561088,54017,26564,False,Elder doggo does a splash. Both 13/10 incredible stuff https://t.co/gBUDjdEcqz,"<a href=""http://twitter.com/download/iphone"" rel=""nofollow"">Twitter for iPhone</a>",2016-11-07 03:14:10
615,795400264262053889,10942,3195,False,This is Brody. He's trying to make the same face as the football. 12/10 https://t.co/2H4MfOGlpQ,"<a href=""http://twitter.com/download/iphone"" rel=""nofollow"">Twitter for iPhone</a>",2016-11-06 22:59:35
616,795076730285391872,17592,6049,False,This is Bailey. She loves going down slides but is very bad at it. Still 11/10 https://t.co/ivPWhspN3E,"<a href=""http://twitter.com/download/iphone"" rel=""nofollow"">Twitter for iPhone</a>",2016-11-06 01:33:58
617,794983741416415232,0,3763,False,RT @dog_rates: This is Rizzy. She smiles a lot. 12/10 contagious af https://t.co/TU4sZogVIq,"<a href=""http://twitter.com/download/iphone"" rel=""nofollow"">Twitter for iPhone</a>",2016-11-05 19:24:28
618,794926597468000259,11135,2583,False,This is Mack. He's rather h*ckin sleepy. Exceptional ears. 12/10 would boop https://t.co/XRPvTPF0VH,"<a href=""http://twitter.com/download/iphone"" rel=""nofollow"">Twitter for iPhone</a>",2016-11-05 15:37:24
619,794355576146903043,0,11481,False,RT @dog_rates: This is Butter. She can have whatever she wants forever. 12/10 would hug softly https://t.co/x5gXRS1abq,"<a href=""http://twitter.com/download/iphone"" rel=""nofollow"">Twitter for iPhone</a>",2016-11-04 01:48:22
620,794332329137291264,10363,2946,False,This is Nimbus (like the cloud). He just bought this fancy af duck raincoat. Only protects one ear tho. 12/10 so h*ckin floofy https://t.co/SIQbb8c3AU,"<a href=""http://twitter.com/download/iphone"" rel=""nofollow"">Twitter for iPhone</a>",2016-11-04 00:15:59
621,794205286408003585,9968,3689,False,This is Laika. She was a space pupper. The first space pupper actually. Orbited earth like a h*ckin boss. 14/10 hero af https://t.co/trSjgY3h4g,"<a href=""http://twitter.com/download/iphone"" rel=""nofollow"">Twitter for iPhone</a>",2016-11-03 15:51:10
622,793962221541933056,18242,5458,False,This is Maximus. His face is stuck like that. Tragic really. Great tongue tho. 12/10 would pet firmly https://t.co/xIfrsMNLBR,"<a href=""http://twitter.com/download/iphone"" rel=""nofollow"">Twitter for iPhone</a>",2016-11-02 23:45:19
623,793845145112371200,9966,2095,False,This is Clark. He was just caught wearing pants. 13/10 game-changing af https://t.co/2Xo19aPrG5,"<a href=""http://twitter.com/download/iphone"" rel=""nofollow"">Twitter for iPhone</a>",2016-11-02 16:00:06
624,793614319594401792,0,3490,False,RT @dog_rates: When she says you're a good boy and you know you're a good boy because you're a good boy. 13/10 https://t.co/O5IUmRHRIh,"<a href=""http://twitter.com/download/iphone"" rel=""nofollow"">Twitter for iPhone</a>",2016-11-02 00:42:53
625,793601777308463104,8644,1825,False,This is Dobby. I can't stop looking at her feet. 12/10 would absolutely snug https://t.co/LhzPWv6rTv,"<a href=""http://twitter.com/download/iphone"" rel=""nofollow"">Twitter for iPhone</a>",2016-11-01 23:53:02
626,793500921481273345,11594,2660,False,This is Fiona. She's an extremely mediocre copilot. Very distracting. Wink makes up for all the missed turns. 12/10 https://t.co/aF5MmpvPqN,"<a href=""http://twitter.com/download/iphone"" rel=""nofollow"">Twitter for iPhone</a>",2016-11-01 17:12:16
627,793286476301799424,26695,10275,False,This is Moreton. He's the Good Boy Who Lived. 13/10 magical as h*ck https://t.co/rLHGx3VAF3,"<a href=""http://twitter.com/download/iphone"" rel=""nofollow"">Twitter for iPhone</a>",2016-11-01 03:00:09
628,793271401113350145,9367,2636,False,Meet Dave. It's his favorite day of the year. He gets to fulfill his dream of being a dinosaur. 12/10 inspirational af https://t.co/MgQSdfZGPN,"<a href=""http://twitter.com/download/iphone"" rel=""nofollow"">Twitter for iPhone</a>",2016-11-01 02:00:14
629,793256262322548741,21647,9296,False,Oh h*ck look at this spookling right here. Fright level off the charts. 12/10 sufficiently spooked https://t.co/BNy9IIJMb0,"<a href=""http://twitter.com/download/iphone"" rel=""nofollow"">Twitter for iPhone</a>",2016-11-01 01:00:05
630,793241302385262592,11402,3663,False,This is Tucker. He's out here bustin h*ckin ghosts. 13/10 dedicated af https://t.co/Ap477GhwXt,"<a href=""http://twitter.com/download/iphone"" rel=""nofollow"">Twitter for iPhone</a>",2016-11-01 00:00:38
631,793226087023144960,10662,3192,False,"This is Juno. She spooked me up real good, but only to get my attention. Above average handwriting for a dog I think. 11/10 https://t.co/hFxxBCWlwj","<a href=""http://twitter.com/download/iphone"" rel=""nofollow"">Twitter for iPhone</a>",2016-10-31 23:00:11
632,793210959003287553,9677,3143,False,This is Maude. She's the h*ckin happiest wasp you've ever seen. 10/10 would pet with caution https://t.co/etL8FHBrh8,"<a href=""http://twitter.com/download/iphone"" rel=""nofollow"">Twitter for iPhone</a>",2016-10-31 22:00:04
633,793195938047070209,16546,6274,False,Say hello to Lily. She's pupset that her costume doesn't fit as well as last year. 12/10 poor puppo https://t.co/YSi6K1firY,"<a href=""http://twitter.com/download/iphone"" rel=""nofollow"">Twitter for iPhone</a>",2016-10-31 21:00:23
634,793180763617361921,7500,2221,False,This is Newt. He's a strawberry. 11/10 https://t.co/2VhmlwxA1Q,"<a href=""http://twitter.com/download/iphone"" rel=""nofollow"">Twitter for iPhone</a>",2016-10-31 20:00:05
635,793165685325201412,10184,3101,False,This is Benji. He's Air Bud. It's a low effort costume but he pulls it off rather h*ckin well. 12/10 would happily get dunked on https://t.co/IbzT7DJvBo,"<a href=""http://twitter.com/download/iphone"" rel=""nofollow"">Twitter for iPhone</a>",2016-10-31 19:00:10
636,793150605191548928,6689,1905,False,This is Nida. She's a free elf. Waited so long for this day. 11/10 https://t.co/3lE8Izgmkf,"<a href=""http://twitter.com/download/iphone"" rel=""nofollow"">Twitter for iPhone</a>",2016-10-31 18:00:14
637,793135492858580992,7008,2780,False,Your favorite squad is looking extra h*ckin spooky today. 13/10 for all https://t.co/PrgvOyPtDT,"<a href=""http://twitter.com/download/iphone"" rel=""nofollow"">Twitter for iPhone</a>",2016-10-31 17:00:11
638,793120401413079041,13755,4356,False,"This is Robin. She's desperately trying to do me a frighten, but her tongue drastically decreases her spook value. Still 11/10 great effort https://t.co/sxMrsOZ8zb","<a href=""http://twitter.com/download/iphone"" rel=""nofollow"">Twitter for iPhone</a>",2016-10-31 16:00:13
639,792913359805018113,15554,4486,False,Here is a perfect example of someone who has their priorities in order. 13/10 for both owner and Forrest https://t.co/LRyMrU7Wfq,"<a href=""http://twitter.com/download/iphone"" rel=""nofollow"">Twitter for iPhone</a>",2016-10-31 02:17:31
640,792883833364439040,12262,4755,False,This is Bailey. She's rather h*ckin hype for Halloween tomorrow. Carved those pupkins herself. 12/10 https://t.co/v17mFm0Ftz,"<a href=""http://twitter.com/download/iphone"" rel=""nofollow"">Twitter for iPhone</a>",2016-10-31 00:20:11
641,792773781206999040,7960,1876,False,This is Monster. Not an actual monster tho. He's showing you his tongue. Very impressive Monster. 12/10 would snug https://t.co/RhaPExuxJL,"<a href=""http://twitter.com/download/iphone"" rel=""nofollow"">Twitter for iPhone</a>",2016-10-30 17:02:53
642,792394556390137856,14608,4777,False,Meet BeBe. She rocks the messy bun of your dreams. H*ckin flawless. 12/10 would watch her tutorial https://t.co/of0pFNBIl8,"<a href=""http://twitter.com/download/iphone"" rel=""nofollow"">Twitter for iPhone</a>",2016-10-29 15:55:58
643,792050063153438720,7786,2005,False,This is Remus. He's a mop that came to life. Can't see anything. Constantly trips over himself. Still a very good dog. 11/10 https://t.co/S3f1SYylzu,"<a href=""http://twitter.com/download/iphone"" rel=""nofollow"">Twitter for iPhone</a>",2016-10-28 17:07:05
644,791821351946420224,0,23442,False,RT @dog_rates: This little fella really hates stairs. Prefers bush. 13/10 legendary pupper https://t.co/e3LPMAHj7p,"<a href=""http://twitter.com/download/iphone"" rel=""nofollow"">Twitter for iPhone</a>",2016-10-28 01:58:16
645,791784077045166082,0,10767,False,RT @dog_rates: I'm not sure what this dog is doing but it's pretty inspirational. 12/10 https://t.co/4Kn9GEHXiE,"<a href=""http://twitter.com/download/iphone"" rel=""nofollow"">Twitter for iPhone</a>",2016-10-27 23:30:09
646,791780927877898241,0,4229,False,RT @dog_rates: This is Maddie. She gets some wicked air time. Hardcore barkour. 11/10 nimble af https://t.co/bROYbceZ1u,"<a href=""http://twitter.com/download/iphone"" rel=""nofollow"">Twitter for iPhone</a>",2016-10-27 23:17:38
