,id,favorite_count,retweet_count,retweeted,full_text,source,created_at
1718,679828447187857408,38369,15207,False,Everybody look at this beautiful pupper 13/10 https://t.co/hyAC5Hq9GC,"<a href=""http://twitter.com/download/iphone"" rel=""nofollow"">Twitter for iPhone</a>",2015-12-24 00:58:27
1719,679777920601223168,3263,1211,False,This is Rinna. She's melting. 10/10 get inside pupper https://t.co/PA0czwucsb,"<a href=""http://twitter.com/download/iphone"" rel=""nofollow"">Twitter for iPhone</a>",2015-12-23 21:37:40
1720,679736210798047232,2212,865,False,This pup's name is Sabertooth (parents must be cool). Ears for days. Jumps unannounced. 9/10 would pet diligently https://t.co/iazoiNUviP,"<a href=""http://twitter.com/download/iphone"" rel=""nofollow"">Twitter for iPhone</a>",2015-12-23 18:51:56
1721,679729593985699840,2286,889,False,This is Hunter. He was playing with his ball minding his own business. Has no idea what happened to the carpet. 8/10 https://t.co/DbUTDI3u1R,"<a href=""http://twitter.com/download/iphone"" rel=""nofollow"">Twitter for iPhone</a>",2015-12-23 18:25:38
1722,679722016581222400,1749,509,False,This is Mike. He is a Jordanian Frito Pilates. Frowning because he can't see directly in front of him. 8/10 https://t.co/NL5QJwdEpF,"<a href=""http://twitter.com/download/iphone"" rel=""nofollow"">Twitter for iPhone</a>",2015-12-23 17:55:32
1723,679530280114372609,5034,2241,False,Guys this really needs to stop. We've been over this way too many times. This is a giraffe. We only rate dogs.. 7/10 https://t.co/yavgkHYPOC,"<a href=""http://twitter.com/download/iphone"" rel=""nofollow"">Twitter for iPhone</a>",2015-12-23 05:13:38
1724,679527802031484928,2798,788,False,This little pupper just arrived. 11/10 would snug https://t.co/DA5aqnSGfB,"<a href=""http://twitter.com/download/iphone"" rel=""nofollow"">Twitter for iPhone</a>",2015-12-23 05:03:47
1725,679511351870550016,3564,1388,False,Say hello to William. He makes fun of others because he's terrified of his own deep-seated insecurities. 7/10 https://t.co/bwuV6FlRxr,"<a href=""http://twitter.com/download/iphone"" rel=""nofollow"">Twitter for iPhone</a>",2015-12-23 03:58:25
1726,679503373272485890,3340,1605,False,This is Dwight. He's a pointy pupper. Very docile. Attracts marshmallows. Hurts to pet but definitely worth it 8/10 https://t.co/jjW7zTxY9Z,"<a href=""http://twitter.com/download/iphone"" rel=""nofollow"">Twitter for iPhone</a>",2015-12-23 03:26:43
1727,679475951516934144,2223,689,False,This is Evy. She doesn't want to be a Koala. 9/10 https://t.co/VITeF0Kl9L,"<a href=""http://twitter.com/download/iphone"" rel=""nofollow"">Twitter for iPhone</a>",2015-12-23 01:37:45
1728,679462823135686656,33575,20398,False,Meet Hurley. He's the curly one. He hugs every other dog he sees during his walk. 11/10 for spreading the love https://t.co/M6vqkt2GKV,"<a href=""http://twitter.com/download/iphone"" rel=""nofollow"">Twitter for iPhone</a>",2015-12-23 00:45:35
1729,679405845277462528,2517,1306,False,Crazy unseen footage from Jurassic Park. 10/10 for both dinosaur puppers https://t.co/L8wt2IpwxO,"<a href=""http://vine.co"" rel=""nofollow"">Vine - Make a Scene</a>",2015-12-22 20:59:10
1730,679158373988876288,22730,8790,False,This is Rubio. He has too much skin. 11/10 https://t.co/NLOHmlENag,"<a href=""http://twitter.com/download/iphone"" rel=""nofollow"">Twitter for iPhone</a>",2015-12-22 04:35:49
1731,679148763231985668,2935,1112,False,I know everyone's excited for Christmas but that doesn't mean you can send in reindeer. We only rate dogs... 8/10 https://t.co/eWjWgbOCYL,"<a href=""http://twitter.com/download/iphone"" rel=""nofollow"">Twitter for iPhone</a>",2015-12-22 03:57:37
1732,679132435750195208,3133,1250,False,This is Louis. He's a river dancer. His friends think it's badass. All are very supportive. 10/10 for Louis https://t.co/qoIvjKMY58,"<a href=""http://twitter.com/download/iphone"" rel=""nofollow"">Twitter for iPhone</a>",2015-12-22 02:52:45
1733,679111216690831360,6290,2764,False,This is officially the greatest yawn of all time. 12/10 https://t.co/4R0Cc0sLVE,"<a href=""http://twitter.com/download/iphone"" rel=""nofollow"">Twitter for iPhone</a>",2015-12-22 01:28:25
1734,679062614270468097,18043,8892,False,This is Chompsky. He lives up to his name. 11/10 https://t.co/Xl37lQEWd0,"<a href=""http://twitter.com/download/iphone"" rel=""nofollow"">Twitter for iPhone</a>",2015-12-21 22:15:18
1735,679047485189439488,2378,738,False,This dog doesn't know how to stairs. Quite tragic really. 9/10 get it together pup https://t.co/kTpr9PTMg1,"<a href=""http://twitter.com/download/iphone"" rel=""nofollow"">Twitter for iPhone</a>",2015-12-21 21:15:11
1736,679001094530465792,2984,1335,False,This is Rascal. He's paddling an imaginary canoe. 11/10 https://t.co/Ajquq6oGSg,"<a href=""http://vine.co"" rel=""nofollow"">Vine - Make a Scene</a>",2015-12-21 18:10:50
1737,678991772295516161,2451,1271,False,If your Monday isn't going so well just take a look at this. Both 12/10 https://t.co/GJT6SILPGU,"<a href=""http://twitter.com/download/iphone"" rel=""nofollow"">Twitter for iPhone</a>",2015-12-21 17:33:48
1738,678969228704284672,1730,498,False,Meet Lola. She's a Metamorphic Chartreuse. Plays with her food. Insubordinate and churlish. Exquisite hardwood 11/10 https://t.co/etpBNXwN7f,"<a href=""http://twitter.com/download/iphone"" rel=""nofollow"">Twitter for iPhone</a>",2015-12-21 16:04:13
1739,678800283649069056,2715,977,False,Here's a pupper with some mean tan lines. Snazzy sweater though 12/10 https://t.co/DpCSVsl6vu,"<a href=""http://twitter.com/download/iphone"" rel=""nofollow"">Twitter for iPhone</a>",2015-12-21 04:52:53
1740,678798276842360832,3681,1286,False,This is Linda. She fucking hates trees. 7/10 https://t.co/blaY85FIxR,"<a href=""http://twitter.com/download/iphone"" rel=""nofollow"">Twitter for iPhone</a>",2015-12-21 04:44:55
1741,678774928607469569,2943,999,False,This is Tug. He's not required to wear the cone he just wants his voice to project more clearly. 11/10 https://t.co/Sp739Ou2qx,"<a href=""http://twitter.com/download/iphone"" rel=""nofollow"">Twitter for iPhone</a>",2015-12-21 03:12:08
1742,678767140346941444,3720,1477,False,This is Mia. She makes awful decisions. 8/10 https://t.co/G6TQVgTcZz,"<a href=""http://twitter.com/download/iphone"" rel=""nofollow"">Twitter for iPhone</a>",2015-12-21 02:41:11
1743,678764513869611008,1725,517,False,"Meet Wilson. He got caught humping the futon. He's like ""dude, help me out here"" 10/10 I'd help Wilson out https://t.co/m6XoclB0qv","<a href=""http://twitter.com/download/iphone"" rel=""nofollow"">Twitter for iPhone</a>",2015-12-21 02:30:45
1744,678755239630127104,7533,3581,False,This is Dash. He didn't think the water would be that cold. Damn it Dash it's December. Think a little. 10/10 https://t.co/NqcOwG8pxW,"<a href=""http://twitter.com/download/iphone"" rel=""nofollow"">Twitter for iPhone</a>",2015-12-21 01:53:54
1745,678740035362037760,3965,1843,False,Meet Tango. He's a large dog. Doesn't care much for personal space. Owner isn't very accepting. Tongue slip. 6/10 https://t.co/p2T5kGebxe,"<a href=""http://twitter.com/download/iphone"" rel=""nofollow"">Twitter for iPhone</a>",2015-12-21 00:53:29
1746,678708137298427904,5854,2629,False,Here we are witnessing a wild field pupper. Lost his wallet in there. Rather unfortunate. 10/10 good luck pup https://t.co/sZy9Co74Bw,"<a href=""http://vine.co"" rel=""nofollow"">Vine - Make a Scene</a>",2015-12-20 22:46:44
1747,678675843183484930,3025,1604,False,Exotic pup here. Tail long af. Throat looks swollen. Might breathe fire. Exceptionally unfluffy 2/10 would still pet https://t.co/a8SqCaSo2r,"<a href=""http://twitter.com/download/iphone"" rel=""nofollow"">Twitter for iPhone</a>",2015-12-20 20:38:24
1748,678643457146150913,2163,460,False,Meet Grizz. He just arrived. Couldn't wait until Christmas. Worried bc he saw the swastikas on the carpet. 10/10 https://t.co/QBGwYrT7rv,"<a href=""http://twitter.com/download/iphone"" rel=""nofollow"">Twitter for iPhone</a>",2015-12-20 18:29:43
1749,678446151570427904,4214,1704,False,Touching scene here. Really stirs up the emotions. The bond between father &amp; son. So beautiful. 10/10 for both pups https://t.co/AJWJHov5gx,"<a href=""http://twitter.com/download/iphone"" rel=""nofollow"">Twitter for iPhone</a>",2015-12-20 05:25:42
1750,678424312106393600,5715,2753,False,This is Crystal. She's a shitty fireman. No sense of urgency. People could be dying Crystal. 2/10 just irresponsible https://t.co/rtMtjSl9pz,"<a href=""http://twitter.com/download/iphone"" rel=""nofollow"">Twitter for iPhone</a>",2015-12-20 03:58:55
1751,678410210315247616,4465,1969,False,Say hello to Jerome. He can shoot french fries out of his mouth at insane speeds. Deadly af. 10/10 https://t.co/dIy88HwrX8,"<a href=""http://twitter.com/download/iphone"" rel=""nofollow"">Twitter for iPhone</a>",2015-12-20 03:02:53
1752,678399652199309312,61124,29808,False,This made my day. 12/10 please enjoy https://t.co/VRTbo3aAcm,"<a href=""http://twitter.com/download/iphone"" rel=""nofollow"">Twitter for iPhone</a>",2015-12-20 02:20:55
1753,678396796259975168,1673,455,False,These little fellas have opposite facial expressions. Both 12/10 https://t.co/LmThv0GWen,"<a href=""http://twitter.com/download/iphone"" rel=""nofollow"">Twitter for iPhone</a>",2015-12-20 02:09:34
1754,678389028614488064,1965,454,False,"This is Bella. She just learned that her final grade in chem was a 92.49 
poor pupper 11/10 https://t.co/auOoKuoveM","<a href=""http://twitter.com/download/iphone"" rel=""nofollow"">Twitter for iPhone</a>",2015-12-20 01:38:42
1755,678380236862578688,2564,974,False,This is Crumpet. He underestimated the snow. Quickly retreating. 10/10 https://t.co/a0Zx5LDFZa,"<a href=""http://twitter.com/download/iphone"" rel=""nofollow"">Twitter for iPhone</a>",2015-12-20 01:03:46
1756,678341075375947776,1820,583,False,This pupper likes tape. 12/10 https://t.co/cSp6w5GWgm,"<a href=""http://twitter.com/download/iphone"" rel=""nofollow"">Twitter for iPhone</a>",2015-12-19 22:28:09
1757,678334497360859136,1369,288,False,This is Rosie. She has a snazzy bow tie and a fin for a tail. Probably super fast underwater. Cool socks 10/10 https://t.co/GO76MdGBs0,"<a href=""http://twitter.com/download/iphone"" rel=""nofollow"">Twitter for iPhone</a>",2015-12-19 22:02:01
1758,678278586130948096,12077,6554,False,Another spooky pupper here. Most definitely floating. No legs. Probably knows some dark magic. 10/10 very spooked https://t.co/JK8MByRzgj,"<a href=""http://twitter.com/download/iphone"" rel=""nofollow"">Twitter for iPhone</a>",2015-12-19 18:19:51
1759,678255464182861824,1666,401,False,This is Jessifer. She is a Bismoth Teriyaki. Flowers being attacked by hurricanes on bandana (rad). 9/10 stellar pup https://t.co/nZhmRwZzWv,"<a href=""http://twitter.com/download/iphone"" rel=""nofollow"">Twitter for iPhone</a>",2015-12-19 16:47:58
1760,678023323247357953,2028,419,False,After getting lost in Reese's eyes for several minutes we're going to upgrade him to a 13/10,"<a href=""http://twitter.com/download/iphone"" rel=""nofollow"">Twitter for iPhone</a>",2015-12-19 01:25:31
1761,678021115718029313,14486,6864,False,This is Reese. He likes holding hands. 12/10 https://t.co/cbLroGCbmh,"<a href=""http://twitter.com/download/iphone"" rel=""nofollow"">Twitter for iPhone</a>",2015-12-19 01:16:45
1762,677961670166224897,3594,1812,False,This is Izzy. She's showing off the dance moves she's been working on. 11/10 I guess hard work pays off https://t.co/4JS92YAxTi,"<a href=""http://vine.co"" rel=""nofollow"">Vine - Make a Scene</a>",2015-12-18 21:20:32
1763,677918531514703872,1413,440,False,"""Everything looks pretty good in there. Make sure to brush your gums. Been flossing? How's school going?"" Both 10/10 https://t.co/lWL2IMJqLR","<a href=""http://twitter.com/download/iphone"" rel=""nofollow"">Twitter for iPhone</a>",2015-12-18 18:29:07
1764,677895101218201600,5081,2274,False,Guys this was terrifying. Really spooked me up. We don't rate ghosts. We rate dogs. Please only send dogs... 9/10 https://t.co/EJImi1udYb,"<a href=""http://twitter.com/download/iphone"" rel=""nofollow"">Twitter for iPhone</a>",2015-12-18 16:56:01
1765,677716515794329600,3199,1044,False,IT'S PUPPERGEDDON. Total of 144/120 ...I think https://t.co/ZanVtAtvIq,"<a href=""http://twitter.com/download/iphone"" rel=""nofollow"">Twitter for iPhone</a>",2015-12-18 05:06:23
1766,677700003327029250,3566,1550,False,This is Ralph. He's an interpretive dancer. 10/10 https://t.co/zoDdPyPFsa,"<a href=""http://twitter.com/download/iphone"" rel=""nofollow"">Twitter for iPhone</a>",2015-12-18 04:00:46
1767,677698403548192770,1284,341,False,This is Sadie. She got her holidays confused. 9/10 damn it Sadie https://t.co/fm7HxOsuPK,"<a href=""http://twitter.com/download/iphone"" rel=""nofollow"">Twitter for iPhone</a>",2015-12-18 03:54:25
1768,677687604918272002,2604,909,False,This was Cindy's face when she heard Susan forgot the snacks for after the kid's soccer game. 11/10 https://t.co/gzkuVGRgAD,"<a href=""http://twitter.com/download/iphone"" rel=""nofollow"">Twitter for iPhone</a>",2015-12-18 03:11:30
1769,677673981332312066,3513,1612,False,Endangered triangular pup here. Could be a wizard. Caught mid-laugh. No legs. Just fluff. Probably a wizard. 9/10 https://t.co/GFVIHIod0Z,"<a href=""http://twitter.com/download/iphone"" rel=""nofollow"">Twitter for iPhone</a>",2015-12-18 02:17:22
1770,677662372920729601,2047,1049,False,"In honor of the new Star Wars movie. Here's Yoda pug. 12/10 pet really well, would I https://t.co/pvjdRn00XH","<a href=""http://twitter.com/download/iphone"" rel=""nofollow"">Twitter for iPhone</a>",2015-12-18 01:31:14
1771,677644091929329666,1973,857,False,This is a dog swinging. I really enjoyed it so I hope you all do as well. 11/10 https://t.co/Ozo9KHTRND,"<a href=""http://twitter.com/download/iphone"" rel=""nofollow"">Twitter for iPhone</a>",2015-12-18 00:18:36
1772,677573743309385728,2245,781,False,This is Sandy. He's sexually confused. Thinks he's a pigeon. Also an All-American cheese catcher. 10/10 so petable https://t.co/Htu8plSqEu,"<a href=""http://twitter.com/download/iphone"" rel=""nofollow"">Twitter for iPhone</a>",2015-12-17 19:39:03
1773,677565715327688705,1356,488,False,Contortionist pup here. Inside pentagram. Clearly worships Satan. Known to slowly push fragile stuff off tables 6/10 https://t.co/EX9oR55VMe,"<a href=""http://twitter.com/download/iphone"" rel=""nofollow"">Twitter for iPhone</a>",2015-12-17 19:07:09
1774,677557565589463040,2559,1249,False,Reckless pupper here. Not even looking at road. Absolute menace. No regard for fellow pupper lives. 10/10 still cute https://t.co/96IBkOYB7j,"<a href=""http://twitter.com/download/iphone"" rel=""nofollow"">Twitter for iPhone</a>",2015-12-17 18:34:46
1775,677547928504967168,7294,3905,False,Not much to say here. I just think everyone needs to see this. 12/10 https://t.co/AGag0hFHpe,"<a href=""http://twitter.com/download/iphone"" rel=""nofollow"">Twitter for iPhone</a>",2015-12-17 17:56:29
1776,677530072887205888,1120,242,False,Say hello to Axel. He's a Black Chevy Pinot on wheels. 0 to 60 in 5.7 seconds (if downhill). 9/10 I call shotgun https://t.co/DKe9DBnnHE,"<a href=""http://twitter.com/download/iphone"" rel=""nofollow"">Twitter for iPhone</a>",2015-12-17 16:45:31
1777,677335745548390400,3207,1928,False,Downright inspiring 12/10 https://t.co/vSLtYBWHcQ,"<a href=""http://vine.co"" rel=""nofollow"">Vine - Make a Scene</a>",2015-12-17 03:53:20
1778,677334615166730240,1425,316,False,This dog gave up mid jump. 9/10 https://t.co/KmMv3Y2zI8,"<a href=""http://twitter.com/download/iphone"" rel=""nofollow"">Twitter for iPhone</a>",2015-12-17 03:48:51
1779,677331501395156992,1145,254,False,Meet Humphrey. He's a Northern Polyp Viagra. One ear works. Face stuck like that. Always surprised. 9/10 petable af https://t.co/FS7eJQM2F4,"<a href=""http://twitter.com/download/iphone"" rel=""nofollow"">Twitter for iPhone</a>",2015-12-17 03:36:28
1780,677328882937298944,3809,1606,False,This is Derek. All the dogs adore Derek. He's a great guy. 10/10 really solid pup https://t.co/KgcsGNb61s,"<a href=""http://twitter.com/download/iphone"" rel=""nofollow"">Twitter for iPhone</a>",2015-12-17 03:26:04
1781,677314812125323265,1724,577,False,"Meet Tassy &amp; Bee. Tassy is pretty chill, but Bee is convinced the Ruffles are haunted. 10/10 &amp; 11/10 respectively https://t.co/fgORpmTN9C","<a href=""http://twitter.com/download/iphone"" rel=""nofollow"">Twitter for iPhone</a>",2015-12-17 02:30:09
1782,677301033169788928,1309,442,False,This is Juckson. He's totally on his way to a nascar race. 5/10 for Juckson https://t.co/IoLRvF0Kak,"<a href=""http://twitter.com/download/iphone"" rel=""nofollow"">Twitter for iPhone</a>",2015-12-17 01:35:24
1783,677269281705472000,2090,756,False,This is the happiest pupper I've ever seen. 10/10 would trade lives with https://t.co/ep8ATEJwRb,"<a href=""http://twitter.com/download/iphone"" rel=""nofollow"">Twitter for iPhone</a>",2015-12-16 23:29:14
1784,677228873407442944,3717,1757,False,Say hello to Chuq. He just wants to fit in. 11/10 https://t.co/hGkMCjZzn4,"<a href=""http://twitter.com/download/iphone"" rel=""nofollow"">Twitter for iPhone</a>",2015-12-16 20:48:40
1785,677187300187611136,2870,987,False,Here we see a Byzantine Rigatoni. Very aerodynamic. No eyes. Actually not windy here they just look like that. 9/10 https://t.co/gzI0m6wXRo,"<a href=""http://twitter.com/download/iphone"" rel=""nofollow"">Twitter for iPhone</a>",2015-12-16 18:03:28
1786,676975532580409345,2911,1150,False,This is Cooper. He doesn't know how cheese works. Likes the way it feels on his face. Cheeky tongue slip. 11/10 https://t.co/j1zczS0lI5,"<a href=""http://twitter.com/download/iphone"" rel=""nofollow"">Twitter for iPhone</a>",2015-12-16 04:01:59
1787,676957860086095872,2313,867,False,10/10 I'd follow this dog into battle no questions asked https://t.co/ngTNXYQF0L,"<a href=""http://twitter.com/download/iphone"" rel=""nofollow"">Twitter for iPhone</a>",2015-12-16 02:51:45
1788,676949632774234114,1363,424,False,This is Tyrus. He's a Speckled Centennial Ticonderoga. Terrified of floating red ball. Nifty bandana. 8/10 v petable https://t.co/HqM3YhCaaa,"<a href=""http://twitter.com/download/iphone"" rel=""nofollow"">Twitter for iPhone</a>",2015-12-16 02:19:04
1789,676948236477857792,2281,937,False,This is Karl. Karl thinks he's slick. 6/10 sneaky pup https://t.co/Lo4ALwjVh4,"<a href=""http://twitter.com/download/iphone"" rel=""nofollow"">Twitter for iPhone</a>",2015-12-16 02:13:31
1790,676946864479084545,1782,405,False,This pups goal was to get all four feet as close to each other as possible. Valiant effort 12/10 https://t.co/2mXALbgBTV,"<a href=""http://twitter.com/download/iphone"" rel=""nofollow"">Twitter for iPhone</a>",2015-12-16 02:08:04
1791,676942428000112642,2172,814,False,Who leaves the last cupcake just sitting there? 9/10 https://t.co/PWMqAoEx2a,"<a href=""http://twitter.com/download/iphone"" rel=""nofollow"">Twitter for iPhone</a>",2015-12-16 01:50:26
1792,676936541936185344,13320,5270,False,Here we see a rare pouched pupper. Ample storage space. Looks alert. Jumps at random. Kicked open that door. 8/10 https://t.co/mqvaxleHRz,"<a href=""http://twitter.com/download/iphone"" rel=""nofollow"">Twitter for iPhone</a>",2015-12-16 01:27:03
1793,676916996760600576,3109,1925,False,Super speedy pupper. Does not go gentle into that goodnight. 10/10 https://t.co/uPXBXS1XNb,"<a href=""http://vine.co"" rel=""nofollow"">Vine - Make a Scene</a>",2015-12-16 00:09:23
1794,676897532954456065,2362,782,False,Exotic handheld dog here. Appears unathletic. Feet look deadly. Can be thrown a great distance. 5/10 might pet idk https://t.co/Avq4awulqk,"<a href=""http://twitter.com/download/iphone"" rel=""nofollow"">Twitter for iPhone</a>",2015-12-15 22:52:02
1795,676864501615042560,2208,766,False,Meet Ash. He's just a head now. Lost his body during the Third Crusade. Still in good spirits. 10/10 would pet well https://t.co/NJj2uP0atK,"<a href=""http://twitter.com/download/iphone"" rel=""nofollow"">Twitter for iPhone</a>",2015-12-15 20:40:47
1796,676821958043033607,24187,16761,False,Finally some constructive political change in this country. 11/10 https://t.co/mvQaETHVSb,"<a href=""http://twitter.com/download/iphone"" rel=""nofollow"">Twitter for iPhone</a>",2015-12-15 17:51:44
1797,676819651066732545,1884,709,False,Watch out Airbud. This pupper is also good at the sports. 12/10 I'm thinking D1 https://t.co/1HrFdo7M0C,"<a href=""http://twitter.com/download/iphone"" rel=""nofollow"">Twitter for iPhone</a>",2015-12-15 17:42:34
1798,676811746707918848,1488,455,False,Say hello to Penny &amp; Gizmo. They are practicing their caroling. The ambition in the room is tangible. 9/10 for both https://t.co/aqBHjjh5VD,"<a href=""http://twitter.com/download/iphone"" rel=""nofollow"">Twitter for iPhone</a>",2015-12-15 17:11:09
1799,676776431406465024,5229,2156,False,"When someone yells ""cops!"" at a party and you gotta get your drunk friend out of there. 10/10 https://t.co/4rMZi5Ca1k","<a href=""http://twitter.com/download/iphone"" rel=""nofollow"">Twitter for iPhone</a>",2015-12-15 14:50:49
1800,676617503762681856,3034,1052,False,I promise this wasn't meant to be a cuteness overload account but ermergerd look at this cozy pupper. 13/10 https://t.co/mpQl2rJjDh,"<a href=""http://twitter.com/download/iphone"" rel=""nofollow"">Twitter for iPhone</a>",2015-12-15 04:19:18
1801,676613908052996102,1140,208,False,This is the saddest/sweetest/best picture I've been sent. 12/10 ðŸ˜¢ðŸ¶ https://t.co/vQ2Lw1BLBF,"<a href=""http://twitter.com/download/iphone"" rel=""nofollow"">Twitter for iPhone</a>",2015-12-15 04:05:01
1802,676606785097199616,1971,470,False,*screeches for a sec and then faints* 12/10 https://t.co/N5QL4ySBEx,"<a href=""http://twitter.com/download/iphone"" rel=""nofollow"">Twitter for iPhone</a>",2015-12-15 03:36:42
1803,676603393314578432,1230,418,False,This is Godzilla pupper. He had a ruff childhood &amp; now deflects that pain outward by terrorizing cities. Tragic 9/10 https://t.co/g1tLGkyaxr,"<a href=""http://twitter.com/download/iphone"" rel=""nofollow"">Twitter for iPhone</a>",2015-12-15 03:23:14
1804,676593408224403456,4796,2314,False,This pupper loves leaves. 11/10 for committed leaf lover https://t.co/APvLqbEhkF,"<a href=""http://vine.co"" rel=""nofollow"">Vine - Make a Scene</a>",2015-12-15 02:43:33
1805,676590572941893632,963,135,False,After some outrage from the crowd. Bubbles is being upgraded to a 7/10. That's as high as I'm going. Thank you,"<a href=""http://twitter.com/download/iphone"" rel=""nofollow"">Twitter for iPhone</a>",2015-12-15 02:32:17
1806,676588346097852417,2446,857,False,This is Bubbles. He kinda resembles a fish. Always makes eye contact with u no matter what. Sneaky tongue slip. 5/10 https://t.co/Nrhvc5tLFT,"<a href=""http://twitter.com/download/iphone"" rel=""nofollow"">Twitter for iPhone</a>",2015-12-15 02:23:26
1807,676582956622721024,1260,301,False,"Meet Vinnie. He's having fun while being safe. Well not a lot of fun, but definitely safe, and that's important 8/10 https://t.co/vZYtynZZlH","<a href=""http://twitter.com/download/iphone"" rel=""nofollow"">Twitter for iPhone</a>",2015-12-15 02:02:01
1808,676575501977128964,2706,1202,False,This pupper is very passionate about Christmas. Wanted to give the tree a hug. So cute. 8/10 https://t.co/NsGyECJuq7,"<a href=""http://twitter.com/download/iphone"" rel=""nofollow"">Twitter for iPhone</a>",2015-12-15 01:32:24
1809,676533798876651520,1964,596,False,ITSOFLUFFAYYYYY 12/10 https://t.co/bfw13CnuuZ,"<a href=""http://twitter.com/download/iphone"" rel=""nofollow"">Twitter for iPhone</a>",2015-12-14 22:46:41
1810,676496375194980353,1590,570,False,Say hello to Griffin. He's upset because his costume for Halloween didn't arrive until today. 9/10 cheer up pup https://t.co/eoBCjSFajX,"<a href=""http://twitter.com/download/iphone"" rel=""nofollow"">Twitter for iPhone</a>",2015-12-14 20:17:59
1811,676470639084101634,12160,5000,False,Three generations of pupper. 11/10 for all https://t.co/tAmQYvzrau,"<a href=""http://twitter.com/download/iphone"" rel=""nofollow"">Twitter for iPhone</a>",2015-12-14 18:35:43
1812,676440007570247681,1798,715,False,Hope your Monday isn't too awful. Here's two baseball puppers. 11/10 for each https://t.co/dB0H9hdZai,"<a href=""http://twitter.com/download/iphone"" rel=""nofollow"">Twitter for iPhone</a>",2015-12-14 16:34:00
1813,676430933382295552,1462,370,False,"Meet Duke. He's an Urban Parmesan. They know he's scared of the green rubber dog. ""Why u do dis?"" thinks Duke. 10/10 https://t.co/3bim9U5Idr","<a href=""http://twitter.com/download/iphone"" rel=""nofollow"">Twitter for iPhone</a>",2015-12-14 15:57:56
1814,676263575653122048,2173,586,False,All this pupper wanted to do was go skiing. No one told him about the El NiÃ±o. Poor pupper. 10/10 maybe next year https://t.co/fTgbq1UBR9,"<a href=""http://twitter.com/download/iphone"" rel=""nofollow"">Twitter for iPhone</a>",2015-12-14 04:52:55
1815,676237365392908289,1276,314,False,Say hello to Winston. He has no respect for the system. Much rebellion. I think that's a palm tree... nice. 8/10 https://t.co/dOLQddhXLZ,"<a href=""http://twitter.com/download/iphone"" rel=""nofollow"">Twitter for iPhone</a>",2015-12-14 03:08:46
1816,676219687039057920,78354,33219,False,This is Kenneth. He's stuck in a bubble. 10/10 hang in there Kenneth https://t.co/uQt37xlYMJ,"<a href=""http://twitter.com/download/iphone"" rel=""nofollow"">Twitter for iPhone</a>",2015-12-14 01:58:31
1817,676215927814406144,1820,629,False,This is Herm. He just wants to be like the other dogs. Sneaky tongue slip. Super fuzzy. 9/10 would cuddle firmly https://t.co/tg8h9lzCHv,"<a href=""http://twitter.com/download/iphone"" rel=""nofollow"">Twitter for iPhone</a>",2015-12-14 01:43:35
