,id,favorite_count,retweet_count,retweeted,full_text,source,created_at
0,892420643555336193,38444,8456,False,This is Phineas. He's a mystical boy. Only ever appears in the hole of a donut. 13/10 https://t.co/MgUWQ76dJU,"<a href=""http://twitter.com/download/iphone"" rel=""nofollow"">Twitter for iPhone</a>",2017-08-01 16:23:56
1,892177421306343426,32939,6230,False,"This is Tilly. She's just checking pup on you. Hopes you're doing ok. If not, she's available for pats, snugs, boops, the whole bit. 13/10 https://t.co/0Xxu71qeIV","<a href=""http://twitter.com/download/iphone"" rel=""nofollow"">Twitter for iPhone</a>",2017-08-01 00:17:27
2,891815181378084864,24815,4129,False,This is Archie. He is a rare Norwegian Pouncing Corgo. Lives in the tall grass. You never know when one may strike. 12/10 https://t.co/wUnZnhtVJB,"<a href=""http://twitter.com/download/iphone"" rel=""nofollow"">Twitter for iPhone</a>",2017-07-31 00:18:03
3,891689557279858688,41797,8586,False,This is Darla. She commenced a snooze mid meal. 13/10 happens to the best of us https://t.co/tD36da7qLQ,"<a href=""http://twitter.com/download/iphone"" rel=""nofollow"">Twitter for iPhone</a>",2017-07-30 15:58:51
4,891327558926688256,39961,9316,False,"This is Franklin. He would like you to stop calling him ""cute."" He is a very fierce shark and should be respected as such. 12/10 #BarkWeek https://t.co/AtUZn91f7f","<a href=""http://twitter.com/download/iphone"" rel=""nofollow"">Twitter for iPhone</a>",2017-07-29 16:00:24
5,891087950875897856,20057,3087,False,Here we have a majestic great white breaching off South Africa's coast. Absolutely h*ckin breathtaking. 13/10 (IG: tucker_marlo) #BarkWeek https://t.co/kQ04fDDRmh,"<a href=""http://twitter.com/download/iphone"" rel=""nofollow"">Twitter for iPhone</a>",2017-07-29 00:08:17
6,890971913173991426,11740,2053,False,"Meet Jax. He enjoys ice cream so much he gets nervous around it. 13/10 help Jax enjoy more things by clicking below

https://t.co/Zr4hWfAs1H https://t.co/tVJBRMnhxl","<a href=""http://twitter.com/download/iphone"" rel=""nofollow"">Twitter for iPhone</a>",2017-07-28 16:27:12
7,890729181411237888,64910,18767,False,When you watch your owner call another dog a good boy but then they turn back to you and say you're a great boy. 13/10 https://t.co/v0nONBcwxq,"<a href=""http://twitter.com/download/iphone"" rel=""nofollow"">Twitter for iPhone</a>",2017-07-28 00:22:40
8,890609185150312448,27574,4238,False,This is Zoey. She doesn't want to be one of the scary sharks. Just wants to be a snuggly pettable boatpet. 13/10 #BarkWeek https://t.co/9TwLuAGH0b,"<a href=""http://twitter.com/download/iphone"" rel=""nofollow"">Twitter for iPhone</a>",2017-07-27 16:25:51
9,890240255349198849,31646,7346,False,This is Cassie. She is a college pup. Studying international doggo communication and stick theory. 14/10 so elegant much sophisticate https://t.co/t1bfwz5S2A,"<a href=""http://twitter.com/download/iphone"" rel=""nofollow"">Twitter for iPhone</a>",2017-07-26 15:59:51
10,890006608113172480,30409,7283,False,This is Koda. He is a South Australian deckshark. Deceptively deadly. Frighteningly majestic. 13/10 would risk a petting #BarkWeek https://t.co/dVPW0B0Mme,"<a href=""http://twitter.com/download/iphone"" rel=""nofollow"">Twitter for iPhone</a>",2017-07-26 00:31:25
11,889880896479866881,27546,4939,False,This is Bruno. He is a service shark. Only gets out of the water to assist you. 13/10 terrifyingly good boy https://t.co/u1XPQMl29g,"<a href=""http://twitter.com/download/iphone"" rel=""nofollow"">Twitter for iPhone</a>",2017-07-25 16:11:53
12,889665388333682689,47712,9990,False,Here's a puppo that seems to be on the fence about something haha no but seriously someone help her. 13/10 https://t.co/BxvuXk0UCm,"<a href=""http://twitter.com/download/iphone"" rel=""nofollow"">Twitter for iPhone</a>",2017-07-25 01:55:32
13,889638837579907072,26934,4513,False,This is Ted. He does his best. Sometimes that's not enough. But it's ok. 12/10 would assist https://t.co/f8dEDcrKSR,"<a href=""http://twitter.com/download/iphone"" rel=""nofollow"">Twitter for iPhone</a>",2017-07-25 00:10:02
14,889531135344209921,14971,2224,False,This is Stuart. He's sporting his favorite fanny pack. Secretly filled with bones only. 13/10 puppared puppo #BarkWeek https://t.co/y70o6h3isq,"<a href=""http://twitter.com/download/iphone"" rel=""nofollow"">Twitter for iPhone</a>",2017-07-24 17:02:04
15,889278841981685760,25082,5384,False,This is Oliver. You're witnessing one of his many brutal attacks. Seems to be playing with his victim. 13/10 fr*ckin frightening #BarkWeek https://t.co/WpHvrQedPb,"<a href=""http://twitter.com/download/iphone"" rel=""nofollow"">Twitter for iPhone</a>",2017-07-24 00:19:32
16,888917238123831296,28847,4473,False,This is Jim. He found a fren. Taught him how to sit like the good boys. 12/10 for both https://t.co/chxruIOUJN,"<a href=""http://twitter.com/download/iphone"" rel=""nofollow"">Twitter for iPhone</a>",2017-07-23 00:22:39
17,888804989199671297,25369,4295,False,This is Zeke. He has a new stick. Very proud of it. Would like you to throw it for him without taking it. 13/10 would do my best https://t.co/HTQ77yNQ5K,"<a href=""http://twitter.com/download/iphone"" rel=""nofollow"">Twitter for iPhone</a>",2017-07-22 16:56:37
18,888554962724278272,19712,3556,False,This is Ralphus. He's powering up. Attempting maximum borkdrive. 13/10 inspirational af https://t.co/YnYAFCTTiK,"<a href=""http://twitter.com/download/iphone"" rel=""nofollow"">Twitter for iPhone</a>",2017-07-22 00:23:06
19,888078434458587136,21566,3474,False,This is Gerald. He was just told he didn't get the job he interviewed for. A h*ckin injustice. 12/10 didn't want the job anyway https://t.co/DK7iDPfuRX,"<a href=""http://twitter.com/download/iphone"" rel=""nofollow"">Twitter for iPhone</a>",2017-07-20 16:49:33
20,887705289381826560,29916,5350,False,This is Jeffrey. He has a monopoly on the pool noodles. Currently running a 'boop for two' midweek sale. 13/10 h*ckin strategic https://t.co/PhrUk20Q64,"<a href=""http://twitter.com/download/iphone"" rel=""nofollow"">Twitter for iPhone</a>",2017-07-19 16:06:48
21,887517139158093824,45858,11597,False,I've yet to rate a Venezuelan Hover Wiener. This is such an honor. 14/10 paw-inspiring af (IG: roxy.thedoxy) https://t.co/20VrLAA8ba,"<a href=""http://twitter.com/download/iphone"" rel=""nofollow"">Twitter for iPhone</a>",2017-07-19 03:39:09
22,887473957103951883,68532,18072,False,This is Canela. She attempted some fancy porch pics. They were unsuccessful. 13/10 someone help her https://t.co/cLyzpcUcMX,"<a href=""http://twitter.com/download/iphone"" rel=""nofollow"">Twitter for iPhone</a>",2017-07-19 00:47:34
23,887343217045368832,33401,10332,False,You may not have known you needed to see this today. 13/10 please enjoy (IG: emmylouroo) https://t.co/WZqNqygEyV,"<a href=""http://twitter.com/download/iphone"" rel=""nofollow"">Twitter for iPhone</a>",2017-07-18 16:08:03
24,887101392804085760,30282,5920,False,This... is a Jubilant Antarctic House Bear. We only rate dogs. Please only send dogs. Thank you... 12/10 would suffocate in floof https://t.co/4Ad1jzJSdp,"<a href=""http://twitter.com/download/iphone"" rel=""nofollow"">Twitter for iPhone</a>",2017-07-18 00:07:08
25,886983233522544640,34872,7726,False,This is Maya. She's very shy. Rarely leaves her cup. 13/10 would find her an environment to thrive in https://t.co/I6oNy0CgiT,"<a href=""http://twitter.com/download/iphone"" rel=""nofollow"">Twitter for iPhone</a>",2017-07-17 16:17:36
26,886736880519319552,11957,3270,False,"This is Mingus. He's a wonderful father to his smol pup. Confirmed 13/10, but he needs your help

https://t.co/bVi0Yr4Cff https://t.co/ISvKOSkd5b","<a href=""http://twitter.com/download/iphone"" rel=""nofollow"">Twitter for iPhone</a>",2017-07-16 23:58:41
27,886680336477933568,22241,4437,False,This is Derek. He's late for a dog meeting. 13/10 pet...al to the metal https://t.co/BCoWue0abA,"<a href=""http://twitter.com/download/iphone"" rel=""nofollow"">Twitter for iPhone</a>",2017-07-16 20:14:00
28,886366144734445568,21016,3179,False,This is Roscoe. Another pupper fallen victim to spontaneous tongue ejections. Get the BlepiPen immediate. 12/10 deep breaths Roscoe https://t.co/RGE08MIJox,"<a href=""http://twitter.com/download/iphone"" rel=""nofollow"">Twitter for iPhone</a>",2017-07-15 23:25:31
29,886267009285017600,116,4,False,@NonWhiteHat @MayhewMayhem omg hello tanner you are a scary good boy 12/10 would pet with extreme caution,"<a href=""http://twitter.com/download/iphone"" rel=""nofollow"">Twitter for iPhone</a>",2017-07-15 16:51:35
30,886258384151887873,27748,6230,False,This is Waffles. His doggles are pupside down. Unsure how to fix. 13/10 someone assist Waffles https://t.co/xZDA9Qsq1O,"<a href=""http://twitter.com/download/iphone"" rel=""nofollow"">Twitter for iPhone</a>",2017-07-15 16:17:19
31,886054160059072513,0,104,False,RT @Athletics: 12/10 #BATP https://t.co/WxwJmvjfxo,"<a href=""http://twitter.com/download/iphone"" rel=""nofollow"">Twitter for iPhone</a>",2017-07-15 02:45:48
32,885984800019947520,32419,6768,False,Viewer discretion advised. This is Jimbo. He will rip ur finger right h*ckin off. Other dog clearly an accessory. 12/10 pls pet with caution https://t.co/BuveP0uMF1,"<a href=""http://twitter.com/download/iphone"" rel=""nofollow"">Twitter for iPhone</a>",2017-07-14 22:10:11
33,885528943205470208,35679,6386,False,This is Maisey. She fell asleep mid-excavation. Happens to the best of us. 13/10 would pat noggin approvingly https://t.co/tp1kQ8i9JF,"<a href=""http://twitter.com/download/iphone"" rel=""nofollow"">Twitter for iPhone</a>",2017-07-13 15:58:47
34,885518971528720385,20256,3736,False,I have a new hero and his name is Howard. 14/10 https://t.co/gzLHboL7Sk,"<a href=""http://twitter.com/download/iphone"" rel=""nofollow"">Twitter for iPhone</a>",2017-07-13 15:19:09
35,885311592912609280,0,18488,False,RT @dog_rates: This is Lilly. She just parallel barked. Kindly requests a reward now. 13/10 would pet so well https://t.co/SATN4If5H5,"<a href=""http://twitter.com/download/iphone"" rel=""nofollow"">Twitter for iPhone</a>",2017-07-13 01:35:06
36,885167619883638784,21756,4355,False,Here we have a corgi undercover as a malamute. Pawbably doing important investigative work. Zero control over tongue happenings. 13/10 https://t.co/44ItaMubBf,"<a href=""http://twitter.com/download/iphone"" rel=""nofollow"">Twitter for iPhone</a>",2017-07-12 16:03:00
37,884925521741709313,76880,18320,False,"This is Earl. He found a hat. Nervous about what you think of it. 12/10 it's delightful, Earl https://t.co/MYJvdlNRVa","<a href=""http://twitter.com/download/iphone"" rel=""nofollow"">Twitter for iPhone</a>",2017-07-12 00:01:00
38,884876753390489601,27706,5750,False,This is Lola. It's her first time outside. Must test the earth and taste the atmosphere. 13/10 you're doing great Lola https://t.co/74TKAUsLkO,"<a href=""http://twitter.com/download/iphone"" rel=""nofollow"">Twitter for iPhone</a>",2017-07-11 20:47:12
39,884562892145688576,24097,4840,False,This is Kevin. He's just so happy. 13/10 what is your secret Kevin https://t.co/1r4MFCbCX5,"<a href=""http://twitter.com/download/iphone"" rel=""nofollow"">Twitter for iPhone</a>",2017-07-11 00:00:02
40,884441805382717440,26761,5616,False,"I present to you, Pup in Hat. Pup in Hat is great for all occasions. Extremely versatile. Compact as h*ck. 14/10 (IG: itselizabethgales) https://t.co/vvBOcC2VdC","<a href=""http://twitter.com/download/iphone"" rel=""nofollow"">Twitter for iPhone</a>",2017-07-10 15:58:53
41,884247878851493888,72426,20327,False,OMG HE DIDN'T MEAN TO HE WAS JUST TRYING A LITTLE BARKOUR HE'S SUPER SORRY 13/10 WOULD FORGIVE IMMEDIATE https://t.co/uF3pQ8Wubj,"<a href=""http://twitter.com/download/iphone"" rel=""nofollow"">Twitter for iPhone</a>",2017-07-10 03:08:17
42,884162670584377345,20207,2966,False,Meet Yogi. He doesn't have any important dog meetings today he just enjoys looking his best at all times. 12/10 for dangerously dapper doggo https://t.co/YSI00BzTBZ,"<a href=""http://twitter.com/download/iphone"" rel=""nofollow"">Twitter for iPhone</a>",2017-07-09 21:29:42
43,883838122936631299,21722,3425,False,This is Noah. He can't believe someone made this mess. Got the vacuum out for you though. Offered to help clean pup. 12/10 super good boy https://t.co/V85xujjDDY,"<a href=""http://twitter.com/download/iphone"" rel=""nofollow"">Twitter for iPhone</a>",2017-07-09 00:00:04
44,883482846933004288,45557,9905,False,"This is Bella. She hopes her smile made you smile. If not, she is also offering you her favorite monkey. 13.5/10 https://t.co/qjrljjt948","<a href=""http://twitter.com/download/iphone"" rel=""nofollow"">Twitter for iPhone</a>",2017-07-08 00:28:19
45,883360690899218434,22385,3655,False,Meet Grizzwald. He may be the floofiest floofer I ever did see. Lost eyes saving a schoolbus from a volcano erpuption. 13/10 heroic as h*ck https://t.co/rf661IFEYP,"<a href=""http://twitter.com/download/iphone"" rel=""nofollow"">Twitter for iPhone</a>",2017-07-07 16:22:55
46,883117836046086144,36903,6641,False,"Please only send dogs. We don't rate mechanics, no matter how h*ckin good. Thank you... 13/10 would sneak a pat https://t.co/Se5fZ9wp5E","<a href=""http://twitter.com/download/iphone"" rel=""nofollow"">Twitter for iPhone</a>",2017-07-07 00:17:54
47,882992080364220416,23764,3897,False,This is Rusty. He wasn't ready for the first pic. Clearly puppared for the second. 13/10 confirmed great boy https://t.co/tyER0KpdXj,"<a href=""http://twitter.com/download/iphone"" rel=""nofollow"">Twitter for iPhone</a>",2017-07-06 15:58:11
48,882762694511734784,28072,4893,False,This is Gus. He's quite the cheeky pupper. Already perfected the disinterested wink. 12/10 would let steal my girl https://t.co/D43I96SlVu,"<a href=""http://twitter.com/download/iphone"" rel=""nofollow"">Twitter for iPhone</a>",2017-07-06 00:46:41
49,882627270321602560,27682,6058,False,This is Stanley. He has his first swim lesson today. Doggle straps adjusted. Ready to go. 13/10 Phelps is nervous (IG: stanleythe_corgi) https://t.co/Nx52PGwH94,"<a href=""http://twitter.com/download/iphone"" rel=""nofollow"">Twitter for iPhone</a>",2017-07-05 15:48:34
50,882268110199369728,44609,11529,False,This is Alfy. You're witnessing his first watermelon experience. I think it was a success. 13/10 happy 4th Alfy ðŸ‡ºðŸ‡¸ https://t.co/fYP5RlutfA,"<a href=""http://twitter.com/download/iphone"" rel=""nofollow"">Twitter for iPhone</a>",2017-07-04 16:01:23
51,882045870035918850,29114,4946,False,"This is Koko. Her owner, inspired by Barney, recently built a cart for her to use during walks if she got tired. 13/10 rest easy Koko https://t.co/zeDpnsKX7w","<a href=""http://twitter.com/download/iphone"" rel=""nofollow"">Twitter for iPhone</a>",2017-07-04 01:18:17
52,881906580714921986,24099,3386,False,This is Rey. He's a Benebop Cumberfloof. 12/10 dangerously pettable https://t.co/503CgWbhxQ,"<a href=""http://twitter.com/download/iphone"" rel=""nofollow"">Twitter for iPhone</a>",2017-07-03 16:04:48
53,881666595344535552,50132,10604,False,This is Gary. He couldn't miss this puppertunity for a selfie. Flawless focusing skills. 13/10 would boop intensely https://t.co/7CSWCl8I6s,"<a href=""http://twitter.com/download/iphone"" rel=""nofollow"">Twitter for iPhone</a>",2017-07-03 00:11:11
54,881633300179243008,126,7,False,@roushfenway These are good dogs but 17/10 is an emotional impulse rating. More like 13/10s,"<a href=""http://twitter.com/download/iphone"" rel=""nofollow"">Twitter for iPhone</a>",2017-07-02 21:58:53
55,881536004380872706,49047,15878,False,"Here is a pupper approaching maximum borkdrive. Zooming at never before seen speeds. 14/10 paw-inspiring af 
(IG: puffie_the_chow) https://t.co/ghXBIIeQZF","<a href=""http://twitter.com/download/iphone"" rel=""nofollow"">Twitter for iPhone</a>",2017-07-02 15:32:16
56,881268444196462592,22904,5133,False,Meet Elliot. He's a Canadian Forrest Pup. Unusual number of antlers for a dog. Sneaky tongue slip to celebrate #Canada150. 12/10 would pet https://t.co/cgwJwowTMC,"<a href=""http://twitter.com/download/iphone"" rel=""nofollow"">Twitter for iPhone</a>",2017-07-01 21:49:04
57,880935762899988482,16877,2767,False,This is Louis. He's crossing. It's a big deal. 13/10 h*ckin breathtaking https://t.co/D0wb1GlKAt,"<a href=""http://twitter.com/download/iphone"" rel=""nofollow"">Twitter for iPhone</a>",2017-06-30 23:47:07
58,880872448815771648,21121,3797,False,Ugh not again. We only rate dogs. Please don't send in well-dressed  floppy-tongued street penguins. Dogs only please. Thank you... 12/10 https://t.co/WiAMbTkDPf,"<a href=""http://twitter.com/download/iphone"" rel=""nofollow"">Twitter for iPhone</a>",2017-06-30 19:35:32
59,880465832366813184,28305,6259,False,This is Bella. She had her first beach experience this morning. Complete success. 12/10 would perform a sandy boop https://t.co/4VsFysDmiw,"<a href=""http://twitter.com/download/iphone"" rel=""nofollow"">Twitter for iPhone</a>",2017-06-29 16:39:47
60,880221127280381952,26835,4205,False,Meet Jesse. He's a Fetty Woof. His tongue ejects without warning. A true bleptomaniac. 12/10 would snug well https://t.co/fUod0tVmvK,"<a href=""http://twitter.com/download/iphone"" rel=""nofollow"">Twitter for iPhone</a>",2017-06-29 00:27:25
61,880095782870896641,27402,4346,False,Please don't send in photos without dogs in them. We're not @porch_rates. Insubordinate and churlish. Pretty good porch tho 11/10 https://t.co/HauE8M3Bu4,"<a href=""http://twitter.com/download/iphone"" rel=""nofollow"">Twitter for iPhone</a>",2017-06-28 16:09:20
62,879862464715927552,22154,3482,False,This is Romeo. He would like to do an entrance. Requesting your immediate assistance. 13/10 https://t.co/Qh5aEkRQm9,"<a href=""http://twitter.com/download/iphone"" rel=""nofollow"">Twitter for iPhone</a>",2017-06-28 00:42:13
63,879674319642796034,310,10,False,@RealKentMurphy 14/10 confirmed,"<a href=""http://twitter.com/download/iphone"" rel=""nofollow"">Twitter for iPhone</a>",2017-06-27 12:14:36
64,879492040517615616,23229,3171,False,This is Bailey. He thinks you should measure ear length for signs of growth instead. 12/10 https://t.co/IxM9IMKQq8,"<a href=""http://twitter.com/download/iphone"" rel=""nofollow"">Twitter for iPhone</a>",2017-06-27 00:10:17
65,879415818425184262,105042,43996,False,This is Duddles. He did an attempt. 13/10 someone help him (vid by Georgia Felici) https://t.co/UDT7ZkcTgY,"<a href=""http://twitter.com/download/iphone"" rel=""nofollow"">Twitter for iPhone</a>",2017-06-26 19:07:24
66,879376492567855104,16639,3107,False,This is Jack AKA Stephen Furry. You're not scoring on him. Unless he slips down the slide. 12/10 would happily get blocked by https://t.co/0gOi601EAa,"<a href=""http://twitter.com/download/iphone"" rel=""nofollow"">Twitter for iPhone</a>",2017-06-26 16:31:08
67,879130579576475649,0,6817,False,RT @dog_rates: This is Emmy. She was adopted today. Massive round of pupplause for Emmy and her new family. 14/10 for all involved https://â€¦,"<a href=""http://twitter.com/download/iphone"" rel=""nofollow"">Twitter for iPhone</a>",2017-06-26 00:13:58
68,879050749262655488,22402,4698,False,This is Steven. He has trouble relating to other dogs. Quite shy. Neck longer than average. Tropical probably. 11/10 would still pet https://t.co/2mJCDEJWdD,"<a href=""http://twitter.com/download/iphone"" rel=""nofollow"">Twitter for iPhone</a>",2017-06-25 18:56:45
69,879008229531029506,18822,2677,False,This is Beau. That is Beau's balloon. He takes it everywhere. 13/10 would protect at all costs https://t.co/YDtpCjIPKN,"<a href=""http://twitter.com/download/iphone"" rel=""nofollow"">Twitter for iPhone</a>",2017-06-25 16:07:47
70,878776093423087618,19268,4116,False,This is Snoopy. He's a proud #PrideMonthPuppo. Impeccable handwriting for not having thumbs. 13/10 would love back #PrideMonth https://t.co/lNZwgNO4gS,"<a href=""http://twitter.com/download/iphone"" rel=""nofollow"">Twitter for iPhone</a>",2017-06-25 00:45:22
71,878604707211726852,30043,7180,False,Martha is stunning how h*ckin dare you. 13/10 https://t.co/9uABQXgjwa,"<a href=""http://twitter.com/download/iphone"" rel=""nofollow"">Twitter for iPhone</a>",2017-06-24 13:24:20
72,878404777348136964,0,1284,False,"RT @dog_rates: Meet Shadow. In an attempt to reach maximum zooming borkdrive, he tore his ACL. Still 13/10 tho. Help him out below

https:/â€¦","<a href=""http://twitter.com/download/iphone"" rel=""nofollow"">Twitter for iPhone</a>",2017-06-24 00:09:53
73,878316110768087041,0,6634,False,RT @dog_rates: Meet Terrance. He's being yelled at because he stapled the wrong stuff together. 11/10 hang in there Terrance https://t.co/iâ€¦,"<a href=""http://twitter.com/download/iphone"" rel=""nofollow"">Twitter for iPhone</a>",2017-06-23 18:17:33
74,878281511006478336,7690,1284,False,"Meet Shadow. In an attempt to reach maximum zooming borkdrive, he tore his ACL. Still 13/10 tho. Help him out below

https://t.co/245xJJElsY https://t.co/lUiQH219v6","<a href=""http://twitter.com/download/iphone"" rel=""nofollow"">Twitter for iPhone</a>",2017-06-23 16:00:04
75,878057613040115712,41708,6817,False,This is Emmy. She was adopted today. Massive round of pupplause for Emmy and her new family. 14/10 for all involved https://t.co/cwtWnHMVpe,"<a href=""http://twitter.com/download/iphone"" rel=""nofollow"">Twitter for iPhone</a>",2017-06-23 01:10:23
76,877736472329191424,79284,19054,False,This is Aja. She was just told she's a good dog. Suspicions confirmed. 13/10 would tell again https://t.co/lsPyyAiF1r,"<a href=""http://twitter.com/download/iphone"" rel=""nofollow"">Twitter for iPhone</a>",2017-06-22 03:54:17
77,877611172832227328,0,80,False,RT @rachel2195: @dog_rates the boyfriend and his soaking wet pupper h*cking love his new hat 14/10 https://t.co/dJx4Gzc50G,"<a href=""http://twitter.com/download/iphone"" rel=""nofollow"">Twitter for iPhone</a>",2017-06-21 19:36:23
78,877556246731214848,22562,3806,False,This is Penny. She's both pupset and fired pup. Not pleased w your barbaric attempts at cleanliness. 12/10 would enjoy more shampoo options https://t.co/OYdDlfOGXP,"<a href=""http://twitter.com/download/iphone"" rel=""nofollow"">Twitter for iPhone</a>",2017-06-21 15:58:08
79,877316821321428993,27158,5161,False,"Meet Dante. At first he wasn't a fan of his new raincoat, then he saw his reflection. H*ckin handsome. 13/10 for water resistant good boy https://t.co/SHRTIo5pxc","<a href=""http://twitter.com/download/iphone"" rel=""nofollow"">Twitter for iPhone</a>",2017-06-21 00:06:44
80,877201837425926144,26904,5575,False,This is Nelly. He graduated with his dogtorate today. Wants to know if you're proud of him. 12/10 would give congratulatory boop https://t.co/4g4cfj3P4Y,"<a href=""http://twitter.com/download/iphone"" rel=""nofollow"">Twitter for iPhone</a>",2017-06-20 16:29:50
81,876838120628539392,20524,3344,False,This is Ginger. She's having a ruff Monday. Too many pupper things going on. H*ckin exhausting. 12/10 would snug passionately https://t.co/j211oCDRs6,"<a href=""http://twitter.com/download/iphone"" rel=""nofollow"">Twitter for iPhone</a>",2017-06-19 16:24:33
82,876537666061221889,23300,4610,False,I can say with the pupmost confidence that the doggos who assisted with this search are heroic as h*ck. 14/10 for all https://t.co/8yoc1CNTsu,"<a href=""http://twitter.com/download/iphone"" rel=""nofollow"">Twitter for iPhone</a>",2017-06-18 20:30:39
83,876484053909872640,18626,2392,False,This is Benedict. He wants to thank you for this delightful urban walk. Hopes you know he loves you. 13/10 super duper good boy https://t.co/26BXueUgbs,"<a href=""http://twitter.com/download/iphone"" rel=""nofollow"">Twitter for iPhone</a>",2017-06-18 16:57:37
84,876120275196170240,27702,4683,False,"Meet Venti, a seemingly caffeinated puppoccino. She was just informed the weekend would include walks, pats and scritches. 13/10 much excite https://t.co/ejExJFq3ek","<a href=""http://twitter.com/download/iphone"" rel=""nofollow"">Twitter for iPhone</a>",2017-06-17 16:52:05
85,875747767867523072,25025,4282,False,"This is Goose. He's a womanizer. Cheeky as h*ck, but also deep. Tongue slip game on another level. 13/10 will steal your girl https://t.co/V2WlACRJCN","<a href=""http://twitter.com/download/iphone"" rel=""nofollow"">Twitter for iPhone</a>",2017-06-16 16:11:53
86,875144289856114688,21771,4921,False,Meet Nugget and Hank. Nugget took Hank's bone. Hank is wondering if you would please return it to him. Both 13/10 would not intervene https://t.co/ogith9ejNj,"<a href=""http://twitter.com/download/iphone"" rel=""nofollow"">Twitter for iPhone</a>",2017-06-15 00:13:52
87,875097192612077568,27247,6031,False,You'll get your package when that precious man is done appreciating the pups. 13/10 for everyone https://t.co/PFp4MghzBW,"<a href=""http://twitter.com/download/iphone"" rel=""nofollow"">Twitter for iPhone</a>",2017-06-14 21:06:43
88,875021211251597312,25288,4709,False,Guys please stop sending pictures without any dogs in th- oh never mind hello excuse me sir. 12/10 stealthy as h*ck https://t.co/brCQoqc8AW,"<a href=""http://twitter.com/download/iphone"" rel=""nofollow"">Twitter for iPhone</a>",2017-06-14 16:04:48
89,874680097055178752,27647,4648,False,Meet Cash. He hath acquired a stick. A very good stick tbh. 12/10 would pat head approvingly https://t.co/lZhtizkURD,"<a href=""http://twitter.com/download/iphone"" rel=""nofollow"">Twitter for iPhone</a>",2017-06-13 17:29:20
90,874434818259525634,0,14754,False,RT @dog_rates: This is Coco. At first I thought she was a cloud but clouds don't bork with such passion. 12/10 would hug softly https://t.câ€¦,"<a href=""http://twitter.com/download/iphone"" rel=""nofollow"">Twitter for iPhone</a>",2017-06-13 01:14:41
